LD 15 Democrats. Authorized by Kristin Dybvig-Pawelko.,0
"LCV Victory Fund, 740 15th St NW, Washington, DC 20005. Not authorized by any candidate or candidate's committee.",0
LCV Victory Fund,0
Kulkarni for Congress,0
Kos Media LLC.,0
Klean Kanteen,0
Kinzler for Illinois,0
Kate Brophy McGee AZ - Senate,0
"Kasoff for STL, Raymond Harbert, Treasurer",0
Justin Hanson for Congress,0
Just Energy Group Inc.,0
Judge Dan Hinde Campaign in compliance with the voluntary limits of the Judicial Campaign Fairness Act,0
Josh Gottheimer for Congress,0
John C. Ackerman for Tazewell County Clerk,0
Joe Kennedy for Congress.,0
Jody Voss for Mayor,0
Joan For Illinois,0
Jim Schooler for YV Town Council,0
Jim Malone - Precinct 32 Committeeperson,0
Jeff Merkley for Oregon,0
"Jay Inslee for Washington (D) PO BOX 21067 Seattle, WA 98111",0
Jason Lee Benton,0
James Allen,0
JB for Governor,0
It Starts Today and not authorized by any candidate or candidate committee.,0
Issue One Action,0
Iowa Firearms Coalition PAC,0
Indivisible Action,0
Illinois Citizens for Ethics PAC | ICE-PAC,0
Human Rights Watch,0
Human Coalition,0
Howell for McHenry County,0
"House Republican Campaign Committee, Ashley Zane, Treasurer. ",0
"High Ground Political Fund. Not authorized by any candidate, candidate's agent or committee.",0
Henry Martin for Congress,0
Hellmann For County Board,0
Heifer International,0
"Healthy Montana, Dr. Steven Bailey, Treasurer, PO Box 1614, Helena, MT 59624",0
Gregg Johnson for State Senate,0
"Greg Nickel For Harvey County Commission, Veronica Mosqueda-Bargdill, Treasurer",0
GoVote Media Project,0
GREAT AMERICA ALLIANCE,0
Friends to Elect T.J. Wessel,0
Friends to Elect Connie Cobb Madsen,0
Friends to Elect Chris Hankins,0
Friends of the IDF,0
Friends of William J. Kelly,0
Friends of Vincent F. Cornelius,0
Friends of Tom Cullerton,0
Friends of Shirley Bell,0
Friends of Ryan Scritchlow,0
Friends of Robert Martwick,0
Friends of Nero,0
Friends of Naomi,0
Friends of Mike Murphy,0
Friends of Mihalyfy,0
Friends of Marty Quinn Senate 2018,0
Friends of Martin A. Sandoval ,0
Friends of Marianne Lalonde,0
Friends of Logan Smith,0
"Friends of Klenc, Corrine Edwards, Treasurer",0
Friends of Kevin Gaither,0
Friends of Ken Idstein,0
Friends of Juarez,0
Friends of Joel Abelove,0
Friends of Joe Bruscato,0
Friends of Jerry Costello II,0
Friends of Jen Metzger,0
Friends of James Skoufis,0
"Friends of Gordy Hulten. A copy of our report is on file with the State Board of Elections, Springfield, IL.",0
Friends of Gilbert Villegas,0
Friends of George Cardenas Political Committee,0
Friends of Elizabeth Johnston,0
Friends of Eileen Dordek,0
Friends of Ed Gallagher,0
Friends of E. Ryan Hall,0
Friends of Chris Kious,0
Friends of Chris Guy,0
Friends of Cabonargi,0
Friends of Bridget Fitzgerald ,0
Friends of Bridget Fitzgerald,0
Friends of Bill Lowry,0
Friends of Ann Dempsey,0
Friends for Rashid,0
Friends for Rafael Yanez,0
Friends for Katie Stuart,0
Friends for Devron Ohrn,0
Friends for David Herrera,0
Friends for Avery Bourne,0
Franklin County Democratic Organization,0
Fountain Valley Firefighters Association,0
Finance Watch Dogs,0
Fayette County Democrat Central Committee,0
ExxonMobil,0
Environmental Defense Fund,0
End Citizens United,0
Elmhurst Community Unit School District 205,0
Ellman for IL Senate D21,0
"Elect Mae Flexer, Ussawin R. Bumpen, Treasurer. Approved by Mae Flexer",0
Elect Knecht for AZ Senate in LD 21,0
"Elect Kevin FitzGerald, Hera Gerber, Treasurer ",0
Education Matters PAC. Committee major funding from Steve & Susan Chamberlin,0
"Edgar County Watchdogs, Inc.",0
ELECT JOSHUA MEDLEY,0
E.O. Wilson Biodiversity Foundation,0
District 200 Vote Yes to Work Together,0
Dinesh D'Souza,0
"Diana Arezzo, Ph.D., concerned private citizen, solely for the purpose of increasing post reach",0
Democratic Socialists of Johnson County,0
Defenders of Wildlife,0
Decriminalize It Indiana,0
Debi Chess Mabie for Pima Community College. Authorized by Debi Chess Mabie. ,0
Debbie Wasserman Schultz for Congress,0
Dean Obeidallah,0
DeWitt County Republican Central Committee,0
David Parker for Illinois ,0
David Earl Williams III,0
Danielle,0
Daniel Didech Campaign Committee,0
DCCC,0
Cownie for Statehouse ,0
Cournoyer for Senate,0
Cook Memorial Public Library District,0
ConservativeMamaPhD,0
Conservative Tribune,0
Connie Beard,0
Concerned Citizens in support of the Jasper County 1-Cent County School Facilities Sales Tax,0
Concealed Online,0
Committee to Elect Tyler R. Edmonds,0
Committee to Elect Sarah Ruholl Sehy,0
Committee to Elect Michael J. Stading,0
Committee to Elect Lyndsay Bloomfield,0
Committee to Elect Lauren Staley Ferry,0
Committee to Elect Katherine Ruocco,0
Committee to Elect Kas Kelly,0
Committee to Elect Judge David W. Dugan,0
Committee to Elect Jeff Mackay Circuit Court Judge,0
Committee to Elect Alpa Patel,0
Committee To Elect Victoria McKay Kennison,0
Committe to Elect Dan Caulkins,0
"Coalition for Affordable, Reliable, and Equitable Housing",0
Clinton County Democratic Central Committee,0
Clearing out the Clutter.  The views expressed are those of the author only.,0
"Clean Air Clean Energy Washington 4347 Roosevelt Way NE Seattle, WA 98105",0
"CivikOwl. We are an independent software company based in California, primarily self-funded, and not affiliated with any political party.",0
Civic Shout,0
Citizens to Save Harley Clarke,0
Citizens to Elect Roger Webber,0
Citizens to Elect James Reilly.,0
Citizens for Tonia Khouri,0
"Citizens for Rauner, Inc.",0
"Citizens for Paul Frank Committee, PO Box 492, Highland Park IL 60035",0
Citizens for Nikki Baer,0
Citizens for Nancy Moss,0
Citizens for Martin T. Tully,0
Citizens for Mark Walker,0
Citizens for Maldonado,0
Citizens for Lori Gummow,0
Citizens for Joe Sosnowski,0
Citizens for Jim Dodge,0
Citizens for Greg Hart,0
Citizens for David Weisiger,0
Citizens for David Michael,0
Citizens for David Beth for Sheriff ,0
Citizens for Dan Hendrickson,0
Citizens for Dan Cronin,0
Citizens for Cramsey,0
Citizens for Connelly,0
Citizens for Benford,0
Citizens for Amy Grant.,0
Citizens for Amanda Biela ,0
Citizens 4 FRC,0
Christian Care Ministry,0
Chicago Humanities Festival,0
Chicago Community Bond Fund,0
Chesney for Illinois ,0
Charles Brandon Brown for Jackson County Board Dist. 2 ,0
Change to Win,0
Catholic Relief Services,0
Casten for Congress,0
Carnegie Corporation of New York,0
Care2,0
Capital Research Center,0
CRTV,0
CONCERNED WOMEN FOR AMERICA ,0
Buffy Wicks for Assembly 2018. FPPC #1396734,0
Bredesen for Senate,0
Bradley College Democrats,0
Bolingbrook First,0
Better Jobs Coalition,0
Ben Chapman for County Board,0
Becket Law,0
"Beachside Media, Inc.",0
Associated Fire Fighters of Illinois PAC,0
Aspire Gear,0
Asele Mack Campaign,0
Armed American Supply,0
Anti-Defamation League,0
Anthony L. McCaskill for City of Harvey Mayor,0
"Andrew Gillum, Democrat, for Governor",0
Andrew Frawley,0
Amiwala for Cook County Board,0
American Tort Reform Association,0
America First Policies,0
Amanda for 35,0
Albert M. Hampton,0
AFSCME Council 31,0
AFP Action,0
ACLU of Northern California,0
A Better Mt. Pleasant,0
45 Hats,0
38th Ward for Ralph Pawlikowski,0
'Supporters of Sadia Covert',0
#VoteTogether,0
 LeftAction,0
