Siegelman for Attorney General,100000
Mike Rogers for Congress,50000
Alabama Political Reporter,50000
Mallory Hagan for Congress,49878
PowerPAC Georgia,18979
"friends of Joe Faust, 20452 Beecher Street, Fairhope AL 36532",10000
Walt Maddox for Governor,10000
"Tim Melson for State Senate P.O. Box 550 Florence, AL",10000
"The committee to elect Judge Wes Allen, PO Box 150, Troy, AL 36081",10000
"The Jim Carns Campaign, P.O. Box 43797, Birmingham, AL 35243 ",10000
"Paid for by the Committee to Elect Brandy Hambright, Circuit Court, PO Box 1901 Mobile, AL 36633",10000
Joel Lee Williams for State Representative,10000
"James Hedgspeth for Etowah County Probate Judge PO Box 1036, Gadsden, AL 35902",10000
Hoover Democrats for Alabama,10000
Committee to Elect Matt Simpson,10000
"Committee to Elect Danny Carr - P.O. Box 1961, Birmingham, AL 35203",10000
Alliance for a Pro-Life Alabama,10000
"Alabama Federation for Children PAC, PO Box 43055, Vestavia, AL 35243",10000
#VOTEPROCHOICE. Not authorized by any candidate or candidate's committee.,10000
"Brett Easterbrook Campaign 633 Escatawpa Rd., Fruitdale, AL 36539",9991
Jefferson Country Sheriff's Office,9954
"The campaign to elect Debbie Wood  3011 20th Avenue Valley, Al. 36854",6732
the Campaign to Re-Elect Senator David Burkette,5000
"McNair For Mobile, PO Box 2604, Mobile, AL, 36652",5000
Lee Auman for United States Congress,5000
"Jefferson County Republican Committee • P.O. Box 590101 • Birmingham, AL 35259",5000
"Friends of Phillip Pettus, 771 County Road 144, Killen, AL 35645",5000
Committee to Elect Scott Hassell PO Box 2739 Gadsden Al 35903,5000
"Committee to Elect Roger Newman Russell County Coroner, 22 Stillwell Drive, Phenix City, AL 36869",5000
"Campaign to Elect Proncey Robertson, P.O. Box 105, Mt. Hope, AL 35651",5000
COMMITTEE TO ELECT ELIZABETH HANEY ,5000
"Butler Co GOP, 112 Stoneroad Drive, Greenville, AL 36067",5000
"Andrew Sorrell Campaign Committee, PO BOX 2876, Muscle Shoals, AL 35662",5000
Jim Toomey,4989
Progress News Network,2318
2A4LIFE LLC,1084
"the Rodney Sullivan Campaign, 5901 6th Avenue Northport, AL 35473",1000
the Milken Family Foundation,1000
"Valerie Bradford Davis Campaign 244 N. Jackson St. Grove Hill, Al 36451",1000
"The Committee to Elect Robert Kennedy, Jr. to U.S. Congress",1000
The Committee to Elect Matt Fridy,1000
"The Committee to Elect J.B. King/P.O. Box 21173 Huntsville, AL 35813",1000
Terri Collins for House District 8,1000
"Ten Commandments Amendment PAC, PO Box 1762, Orange Beach AL  36561",1000
Stutts for Senate,1000
"Nick Smith for Sheriff of Walker County • 758 Saragossa Rd • Nauvoo, AL 35578",1000
"Mike Anderton for District Attorney - Birmingham, AL ",1000
Laura K. Gregory for Probate Judge,1000
Johnny Mack Morrow For State Senate,1000
"Joe Knight Campaign • 3124 Trace Way • Trussville, AL 35173",1000
"Jim Williams 4 Senate 12, PO Box 2811, Anniston, AL 36202",1000
"Jim McClendon for Senate 361 Jones Road Springville, AL 35146",1000
Isbell For House 28,1000
Gary Palmer for Congress,1000
Friends to Elect David Faulkner,1000
"Friends of Will Ainsworth  7520 Browns Valley Rd. Guntersville, AL 35976",1000
Friends of Tabitha Isner,1000
"Friends of Rich Wingo 1105 Southview Lane Box 224 Tuscaloosa, AL 35405",1000
"Friends of Mary Wynne Kling, 300 N Dean Rd Ste 5-182, Auburn, AL 36830",1000
"Friends of Howard Sanderford, 908 Tannahill Drive, Huntsville, AL 35802",1000
Friends of Felicia Stewart,1000
Friends of Clyde Jones,1000
Friends of Arnold Mooney,1000
"Friends of Andrew Jones  690 County Road 202 | Centre, AL 35960",1000
Friends of Alli Summerford,1000
"Friends To Elect Miranda Joseph, PO Box 380454, Birmingham, AL 35238",1000
"Elect Danielle Mashburn-Myrick  P.O. Box 821 Fairhope, AL  36533",1000
Cunningham for Judge,1000
Craig Ford Campaign,1000
Committee to Elect Thomas Thrash ,1000
"Committee to Elect Mark Story 1523 Co Rd 230 Selma, AL",1000
"Committee to Elect Kyle Pierce, PO Box 787, Attalla, AL 35954",1000
Committee to Elect Judge Bob Vance,1000
"Committee to Elect Greg Reed - 800 Hwy 78 E, Ste 200 #106, Jasper, AL 35501",1000
"Caroline Self for Senate, PO Box 714, Florence, AL 35631",1000
Campaign to Elect Proncey Robertson,1000
Campaign To Vote Mike Cole For Sheriff Of Walker County 2018,1000
"By Jeremy H. Oden Campaign POB 9 Eva, Alabama 35621",1000
"Alliance for Alabama’s Infrastructure, 2 North Jackson Street, Montgomery, AL 36104",1000
Adam Jortner for Alabama Board of Education,1000
AIDS Alabama,1000
the Mobile County Republican Executive Committee.,999
Friends of Jennifer Gray,999
"the Joe Lovvorn Campaign, 515 Ogletree Rd, Auburn, AL 36830",997
Committee to Elect Susan Smith,997
Alabama Today.,977
Black Voters Matter Fund,762
Cory Booker for Senate ,716
"Pickens County Republican Executive Committee 17411 Hwy 17 Aliceville, AL 35442",643
Penzeys,490
"the Committee to Elect Chris Blackshear 57 Stonedale Court Smiths Station, AL 36877",364
When We All Vote,343
Donny Moss,299
"Benepath, Inc.",298
Media Research Center,297
Global Citizen,242
2atees1,229
theSkimm,226
American Engagement Technologies,218
"DC Doris for Congress Committee Vicky Ganacias Borja, Treasurer P.O. Box 3060, Hagåtña, Guam 96932",207
Colorado Information Network ,205
Catalyst,194
Alliance Defending Freedom,181
Young America's Foundation,173
PragerU ,171
Homes For Our Troops ,152
Teach For America,141
Shareblue Media,114
Turning Point USA,113
"AAF Nation, LLC",112
Republican Party of Texas and not authorized by any candidate or candidates committee.,74
Save the Children US,69
the Committee to Elect Mark Maples.,64
The Southern Environmental Law Center ,64
Ammar Campa-Najjar for Congress.,60
Yale Climate Connections,51
Dairymen for Arizona,51
the Democratic Governors Association,50
IVN News,50
Aspen Snowmass,48
DeJear for Iowa,45
Building Stronger Communities,45
Florida Strong Action PAC independently of any candidate.,44
California Republican Party,43
the committee to elect Ron Grooms,39
"Vote Daggett, PO Box 1724 Shelton, WA 98584",38
Job Creators Network,37
NARAL Pro-Choice America,35
Daily Wire,35
HomeGrown Tees,33
SIVA Marketing,32
Dayna Steele Campaign,32
"Kansans for a Democratic House, Adam Lusker, Treasurer",31
Finance Watch Dogs,31
Conservstive News ,29
"California Alliance for Progress and Education, an Alliance of Business Organizations",29
Committee to Elect Evan Ross,27
"the House Democratic Campaign Committee. P.O. Box 1925, Austin, TX 78767.",26
Secure Financial Advisory Group,24
NRA,24
the Committee to elect Brad Tennison Chancery Judge,22
the Committee to Elect Amanda Shelton,22
The Ripon Society,22
DREW FERGUSON FOR CONGRESS,22
Redwood Internet LLC,21
"Donald J. Trump for President, Inc.",21
WeThePeopleHolsters ,20
No Labels Action. Not authorized by any candidate or candidate's committee.,20
CINDY HYDE-SMITH FOR US SENATE ,20
Brave Response,20
Teflon Film LLC,19
DD Adams for Congress,18
Conservative Gear,18
Committee to Elect Carrie Jourdan for Chancery Judge  and Approved by Carrie A. Jourdan,18
"1,000 Days ",18
The Brookings Institution,17
"Yes for East Bay Parks – Yes on FF 2018 Major funding by Regional Parks Foundation, Save the Redwoods League. FPPC # 1402363",16
The Years Project,16
Hygeia Analytics,16
Human Coalition,16
Environmental Voter Project,16
Amnesty International USA,14
The Dude's Designs,12
Keep and Bear,12
Free Press,12
Jason Rapert for Arkansas Senate 35,11
Colorado Information Network,11
"CivikOwl. We are an independent software company based in California, primarily self-funded, and not affiliated with any political party.",11
Honest Politics,9
"Air Line Pilots Association, International",9
"Maine Conservation Voters Action Fund, 295 Water St. Ste. 9, Augusta, ME 04330. NOT PAID FOR OR AUTHORIZED BY ANY CANDIDATE.",8
Geoff Duncan for Georgia,8
Defenders of Wildlife,8
the North Carolina Democratic Party and Simon for NC House.,7
the Friends of Jess King,7
Kos Media LLC.,7
Justice Cindy O. Bourland Campaign,7
"20-20 Insight, LLC",7
United Conservatives for Florida,6
UltimateStraw,6
End Citizens United,6
"MoveOn.org Political Action, not authorized by any candidate or candidate's committee.",5
"Minn DFL State Central Committee 255 East Plato Blvd. St. Paul, MN 55107.  It is not coordinated with or approved by any candidate nor is any candidate responsible for it.",5
Heidi for North Dakota,5
"Emily Randall for Senate | PO Box 1883 Port Orchard, WA 98366",5
Woods For Georgia Education,4
"The Accountability Project, Anchorage, AK, Erin Berg, Chair. I am Erin Berg, and I approve this message. Top contributors are the Republican State Leadership Committee, Washington, DC, Advanced Supply Chain International, Anchorage, and Suzanne Downing, Anchorage. This notice to voters is required by Alaska law. ",4
"SMP, and not authorized by any candidate or candidate’s committee.",4
"Nick DiCeglie, Republican, for State Representative",4
Montanans for Tester,4
Alan Wilson for Attorney General,4
14th Congressional District Republican Party of Georgia - not authorized by any candidate or candidate's committee,4
Working Families Party,3
Swing Left. Not authorized by any candidate or candidate's committee.,3
Stitt for Governor 2018,3
"Larry Hogan for Governor, R. Christopher Rosenthal, Treasurer",3
Kentucky Tomorrow. Not Authorized by any candidate or candidate’s committee.,3
Justice Brett Busby Campaign,3
"Judge Pam Derbyshire Campaign, Larry Finder, Treasurer, PO Box 2194, Bellaire TX 77402-2194, in compliance with the voluntary limits of the Judicial Campaign Fairness Act.",3
Forward Majority Action 527 PA PAC. Not authorized by any candidate or candidate’s committee.,3
Bredesen for Senate,3
the North Carolina Democratic Party and Committee to Elect Vernon Moore NC State Senate District 10.,2
the NRCC and not authorized by any candidate or candidate's committee.,2
the Democratic Party of Illinois,2
"by CTMT. David Desjardins, Treasurer. Approved by Chris Conley.",2
"Voters Not Politicians | PO Box 8362 Grand Rapids, MI 49518",2
"The Committee to Elect Eric Bromwell, Stacie Canapp, Treasurer",2
Tewksbury Republican Town Committee,2
Rodriguez for Yorba Linda City Council (FPPC ID 1402990),2
Kate Brophy McGee AZ - Senate,2
Kamala Harris for Senate,2
House Victory PAC and not authorized by any candidate or candidate's committee. ,2
Hagenow for Iowa House,2
Florida Public Utilities,2
Debbie Wasserman Schultz for Congress,2
,2
the North Carolina Democratic Party and Rixon for NC House 9.,1
the North Carolina Democratic Party and Kim Bost for NC House,1
"Strong Economy for All, a fiscally sponsored project of Center for Popular Democracy",1
Planned Parenthood Action PAC North Carolina. Not authorized or in coordination with any campaign.,1
Phillips for Delegate Committee,1
Phil Thompson for Iowa ,1
National Security Action,1
Megan Beaman Jacinto for Coachella City Council 2018,1
LD15 Democrats. Approved by Julie Gunnigle.,1
JB Akers for Mayor,1
Friends of Mary Auker-Endres,1
Friends of Bob Ferguson (D) ,1
Dr. Kim Schrier for Congress,1
Dale Stalf for Judge,1
"Committee to Elect Padma Kuppa, P.O. Box 1874 Troy, MI 48099",1
Committee to Elect Brian Darling Judge,1
Andy Holt For State House,1
American Federation of Teachers,1
Alliance for a Better Minnesota Action Fund. Not Coordinated With Or Approved By Any Candidate Nor Is Any Candidate Responsible For It.,1
yourNEWS Media Group Inc. ,0
the Trump Make America Great Again Committee,0
the Republican National Committee,0
the North Carolina Democratic Party and Sam Edney for NC House.,0
the North Carolina Democratic Party and Ric Vandett for NC Senate.,0
the North Carolina Democratic Party and Rhonda for NC.,0
the North Carolina Democratic Party and Kuppers for Senate.,0
the North Carolina Democratic Party and Jen Mangrum for NC.,0
the North Carolina Democratic Party and Garner for North Carolina.,0
the North Carolina Democratic Party and Gail Young for North Carolina.,0
the North Carolina Democratic Party and Committee to Elect Helen Probst Mills.,0
the North Carolina Democratic Party and Citizens for JD Wooten.,0
the National Democratic Redistricting Committee,0
the Democratic National Committee,0
"the Committee to Elect Sonny Steen, 203 Hollywood Road, Gadsden, AL 35901",0
"the Committee to Elect Nancy Carlton Bendinger, P.O. Box 1869, Auburn,AL 36831",0
the Colorado Times Recorder,0
the ACLU,0
jason sullivan,0
Yellowhammer Fund,0
"Winning For Women, Inc.",0
"Wes Edwards, as private citizen",0
We Stand For USA,0
Vote Yes! for Success,0
Vote Amber Selman-Lynn,0
USA for UNHCR,0
Truthout,0
"Trump 2020 Wear - Apparel Store not associated with the Trump campaign.  This is not a political page directly, we just sell shirts, hats etc.   Our ads will not relate directly to politics or an issue or national importance, just promoting products.  Thx",0
Tony for Wisconsin. ,0
"Tom Parker for Chief Justice, P.O. Box 11822, Montgomery, Alabama, 36111.",0
Tom Malinowski for Congress,0
TheWrap,0
The Social Justice Foundation,0
The Monroe County Republican Party,0
The Finance Advice Org,0
The Family Protection Association,0
"The Committee to Elect Will Benton, P.o.Box 185 Cottondale, Al 35453",0
The Committee to Elect Robert Briggs,0
The Committee to Elect Mark Pettway,0
"The Committee to Elect Emily Page Steele Monroe County District Judge 3 W. Claiborne St. Monroeville, AL 36460",0
"The Committee to Elect Darrell Turner. P.O. Box 671, Heflin, Alabama 36264",0
The Committee to Elect Cory Creel,0
The Collective PAC; not authorized by any candidate or any candidate's committee.,0
The Center for Election Science,0
The Alabama Policy Institute,0
"Ten Commandments Amendment PAC, PO Box 1762, Orange Beach, AL  36561",0
TaxAct,0
Sunday Gover For Assembly 2018,0
Sudan Relief Fund Inc.,0
Stennis Center for Public Service,0
Stand Up America,0
Society To End The Entitlement Mentality,0
"Sky Took, LLC",0
Sierra Club,0
"Shark Tank Media, LLC",0
Senator Brice Wiggins and/or Committee to Elect Brice Wiggins in accordance with MS elections laws.,0
Scott for MN House,0
Science for Humans and Freedom Institute,0
Sarah Smith for US Congress 2018,0
"Rutherford County Democratic Party, Alreen Kohn, Treasurer",0
Rustic Edge Marketing,0
Ro for Congress,0
Right on Crime,0
Rick Scott for Florida,0
Rick Green for Congress,0
"Randy Price for Alabama Senate District 13, P.O. Box 545, Opelika, AL 36803",0
"Public Land, Public Benefit, No on E, Yes on G, a coalition of San Diego taxpayers, community planners, local business, and education, park and environmental advocates. Committee major funding from H.G. Fenton Company and Sudberry Properties.",0
Proud Right Winger,0
Progress Michigan,0
Priorities USA Action and SMP. (302) 469-3772. (202) 871-9255. Not authorized by any candidate or candidate's committee.,0
PrintedKicks,0
Point Source Youth,0
Planned Parenthood Action Fund.,0
Pfizer,0
Patriot Depot,0
Pam Little for State Board of Education District 12,0
"PAID FOR WITH REGULATED FUNDS BY MICHIGAN PLANNED PARENTHOOD VOTES SUPER PAC, P.O. BOX 15041, LANSING, MI 48901. NOT AUTHORIZED BY ANY CANDIDATE OR CANDIDATE’S COMMITTEE.",0
Our Schools Now,0
Our Children's Trust,0
One Nation Design,0
Omaze,0
Old Astoria Neighborhood Association Inc,0
OZY Media,0
Not My NRA,0
"No Plan, No Accountability, No on Prop C",0
No Kid Hungry,0
News For Democracy,0
National Women's Health Network ,0
National Domestic Workers Alliance,0
My Faith Votes,0
"MoveOn.org Political Action, pol.moveon.org, not authorized by any candidate or candidate's committee.",0
Momus LLC dba Deck of Deplorables,0
"Mitchell Blatt, Political Columnist",0
Military Officers Association of America (MOAA),0
Mikie Sherrill for Congress,0
Mike Lee for Baltimore County Council District 2,0
McCaskill for Missouri,0
"Maria Markhasin-Weekes for Broward County Circuit Court Judge, Group 46, Non Partisan",0
Maple Heights African American Gazette,0
Lupe Valdez for Governor,0
Liuba for Congress ,0
Lindsey Deckard for Alabama State Representative,0
LifeDaily,0
Lebowski Lovers,0
Learn Our History,0
Klean Kanteen,0
Kira Fonteneau - The Fonteneau Firm LLC,0
Kevin McCarthy for Congress,0
Kaytlynne Deardorf,0
Kari Powell for PSC,0
"John Paladin and Attorney Paladin, Los Angeles, California. Supporter of National Popular Vote, Every Vote Equal, End Citizens United, Move To Amend, Term Limits and The Federal Accountability Amendment.",0
Joanne Whetstone for House District 90 ,0
Jim Beck for Georgia,0
Jeramey Anderson for Congress,0
Jefferson County Commission,0
Jeffcoat for House 81,0
"James Dolan for Alabama House District 1 110B Tuscaloosa St. Florence, AL 35630 ",0
Jack Burkman,0
International Fund for Animal Welfare,0
Indivisible Action,0
Heifer International,0
"Healthy Montana, Dr. Steven Bailey, Treasurer, PO Box 1614, Helena, MT 59624",0
Harder for Congress,0
Hanu Karlapalem,0
Greenpeace USA,0
Global Hope Network International,0
Giving Brush LLC,0
Genevieve Plumadore for Milaca School Board,0
Friends of the IDF,0
"Friends of Tommy Hyche P.O.Box 374 Northport, AL 35476",0
Friends of Tom Whatley for State Senate,0
"Friends of Nicki Arnold-Swindle, PO Box 1733 Anniston, Alabama 36202",0
Friends of Michela Skelton,0
FreedomWorks for America. Not authorized by any candidate or candidate's committee.,0
Francis Paul Ripp,0
Framed Tweets Inc,0
Florida Young Democrats,0
Florida Sheriff's Association,0
Florida Coastal Property Rights,0
FRIENDS OF SCHUMER,0
Elect Pamela Howard - Alabama House Dist 40,0
Education Matters PAC. Committee major funding from Steve & Susan Chamberlin,0
"East for Probate Judge, PO Box 83, Daviston, AL 36256",0
"Easley For AL House 104 Campaign, PO Box 9591, Mobile AL 36691 (251)273-4178",0
Eagle Point School District 9,0
Dinesh D'Souza,0
Denham for Congress. Approved by Jeff Denham.,0
"Democratic Victory Fund, PO Box 407, Montgomery AL 36101",0
Dean Obeidallah,0
DSCC and authorized by Bredesen for Senate,0
DCCC,0
Concerned Citizen David Townsend,0
Concealed Online,0
"Committee to Elect Sarah Hinkle, Sofi Sanchez Salcedo, Treasurer ",0
Committee to Elect Matt Shelby,0
Committee to Elect Jack Jacobs,0
Committee to Elect Eddie Britton,0
"Committee to Elect Donna Smalley - P.O. Box 2250, Jasper, AL 35502",0
"Committee to Elect Chad Young 100 Francis Ave. ste A Muscle Shoals, AL 35661",0
Committee to Elect Cara McClure  ,0
Committee to Elect Cam Ward,0
"Committee to Elect C. Terry Jones, P.O. Box 228 Meridianville, AL 35759",0
"Committee to Elect Alaric May - 310 Richard Arrington Jr. Blvd, Birmingham, AL 35203",0
Committee To Elect Victoria McKay Kennison,0
Coalition of Minnesota Businesses,0
Civic Shout,0
"Chris Johnson, Columnist & writer",0
Change Now and not authorized by any candidate or candidate’s committee.,0
Carl Carter for Alabama Senate 11,0
Care2,0
Capital Research Center,0
Cameron Smith,0
CRTV,0
CONCERNED WOMEN FOR AMERICA ,0
Beto for Texas,0
Baria for Mississippi,0
Aspire Gear,0
Armed American Supply,0
Anti-Defamation League,0
Andrea S Lindsey Campaign,0
And Approved By Sean McQuade For Orange Soil and Water Seat 2,0
American Heart Association,0
American Gas Association,0
American Beverage Association,0
"Abercrombie for State Rep., Nicole J. Barillaro, Treasurer.  Approved by Cathy Abercrombie.",0
AHIP,0
ACLU of Northern California,0
"ACC Wisconsin PAC. Casey Stafford, Treasurer. Not authorized by any candidate or candidate's agent or committee.",0
AAPI Progressive Action,0
