Leslie H Pico for Secretary of State,11
"Larry Hogan for Governor, R. Christopher Rosenthal, Treasurer",11
John For SC,11
International Crane Foundation,11
Democrats for Marchant,11
Chris Via For Holly Hill Mayor,11
Acción Revolución - VotoMigrante - Jorge Miranda,11
the ASPCA,10
official funds authorized by the House of Representatives,10
"Trey Winder for State Representative, Amy Goodin Treasurer",10
Tirrc Votes,10
SC Club for Growth,10
Ryan McAdams For Congress,10
Robert Hagglund,10
Riggs for Arizona,10
Mid Atlantic LECET,10
McNamara for Delegate,10
Matt Deaver for Legislature,10
Martin for Arizona,10
Liz for Indiana,10
Jordan Hill for House,10
"Greenwich RTC, Lauren Rabin Treasurer",10
Dalton State College,10
Committee to elect Joe Smith Hamilton Co. School Board District 3,10
the Republican Party of Florida.  Not authorized by any candidate or candidate's committee.,9
the Committee to Elect Morgan for Michigan,9
Treasure Coast Conservatives,9
The Colorado Working Families Party IE Committee. Not authorized by any candidate or candidate's committee,9
The Campaign to Elect Josh McCall,9
Tennessee Democratic Party,9
Paul Davis for Kansas,9
"Maine Conservation Voters Action Fund, 295 Water St. Ste. 9, Augusta, ME 04330. NOT PAID FOR OR AUTHORIZED BY ANY CANDIDATE.",9
"Kathy Wolfe Moore for State Representative, Patricia Gaunce, Treasurer",9
Great Lakes Gun Rights,9
"Good Jobs Colorado; Donna Johnson, Registered Agent; Not Authorized by Any Candidate",9
Friends of Marc Friedenberg,9
Friends of Chuck Thomsen,9
Florida Strong Action PAC independently of any candidate.,9
Flaccavento for Congress,9
"Emily Fritz, Non-Partisan for Leon County Commission.",9
Eleni Kounalakis for Lieutenant Governor 2018,9
Donald Lee Sheppard,9
Discover Charter Schools,9
Committee to Elect Charlesetta Wilson,9
Citizens for Richard Brown,9
"Boucher for CT, Ellen Essman, CPA, Treasurer. Approved by Toni Boucher",9
Beverly Powell Campaign,9
Andy Kim for Congress,9
Advancing Florida Agriculture,9
AFSCME Council 31,9
friends of Justin Hwang.,8
When We All Vote,8
Vote Todd Kruse for City Council,8
Tom Wolf for Governor,8
Sally Siegrist for Indiana State Representative District 26,8
"Robin Ficker Campaign Fund, Amy Ginther, Treasurer",8
"Public Land, Public Benefit, No on Measure E, a coalition of San Diego taxpayers, community planners, local business, and education, park and environmental advocates, opposed to SoccerCity. Supported by Mission Valley property owners. Committee major funding from H.G. Fenton Company and Sudberry Properties.",8
Nelson Faerber for Secretary of State,8
Martin Garber for State House 2018,8
"Kristiina Arrasmith for School Board 2018, FPPC #1404044",8
"Kim Rose 2018, Christopher Marino, Treasurer, Approved by Kim Rose ",8
"Keith Perry, Republican, for State Senate, District 8.",8
Julienne D. Hensley,8
Jason Rittereiser for Congress,8
Henry County Republican Party,8
Friends of Denyc Boles,8
Friends of Anton Andrew,8
Fountain Valley Firefighters Association,8
"Committee to Elect Joan Carter Conway, Gerald Stinnette, Treasurer",8
the United Association and not authorized by any candidate or candidate's committee.,7
Vote Chase Turner 21320 Woodland Glen Dr. Northville 48167 MI,7
TONY SANCHEZ FOR COLORADO STATE SENATE,7
Sharice for Congress,7
Prompt Media,7
People for Carlos,7
National Wildlife Federation Action Fund,7
"Joe Shirley, Jr., for President 2018",7
Hernando Beach Community,7
"Healthy Montana, Dr. Steven Bailey, Treasurer, PO Box 1614, Helena, MT 59624",7
"Great Judges for a Great Colorado, Katie Kennedy registered agent. Not authorized by any candidate.",7
Fog Horn Reports,7
"Dominic For Senate, Michele Berardo, Treasurer. Approved by Dominic Rapini ",7
Conservatives for Stringer,7
Colm Willis for Oregon,7
Buffy Wicks for Assembly 2018. FPPC #1396734,7
Bobby Cleveland House District 20 2018,7
"Authority: Brooks Bennett for Delegate, Jillian Bennett, Treasurer",7
William Crawford for Spartanburg County Council D2,6
Tim Worst for City Council ,6
The Palmetto PAC. Not authorized by any candidate or candidate committee. www.palmettopac.org,6
Ruby Corby-O'Neill for Congress,6
"Randy Smith for Commission, Wanda Moody Treasurer",6
Patients For Affordable Drugs Action and not authorized by any candidate or candidate’s committee.,6
PATE FOR IOWA,6
"Juan Alfonso Fernandez-Barquin, Republican, for State Representative, District 119",6
Friends of Stephen Johnston,6
Friends of Josie Raymond,6
"Friends of Jen Jordan, Inc. ",6
"Friends of David Wheeler, 2532 Crossgate Place, Vestavia Hills, AL 35216",6
"Friends For Chris Dodson Dinkins, Paul Fitzwater Treasurer",6
Florida Alliance For Civic Engagement,6
Fighting for Our Future. This communication was not expressly authorized or requested by any candidate or by any candidate's political committees or any of its agents.,6
Dr. Gutierrez for Mayor 2018,6
Don Huffines for Texas Senate,6
"David Trone For Congress, Inc. ",6
Colorado Republican Committee,6
California Republican Party www.cagop.org,6
CITIZENS FOR ENERGIZING MICHIGAN'S ECONOMY,6
Brian Harrington for Laramie City Council,6
Bakersfield Chamber of Commerce Political Action Committee FPPC# 1352944,6
America First Policies,6
"Allison Gilman for Broward County Court Judge, Group 19, Non Partisan",6
"""Electing Emma"" for Adams County",6
the Communications Workers of America,5
friends of John Michael Montgomery 2017,5
Valesky for Senate,5
Utah Decides Healthcare ,5
The Long Island Coalition for Healthy Lawn and Water,5
"Scott Davis for Tennessee.  Tom Baker, Treasurer.",5
Rural Progress PAC,5
Republican Party of Texas and not authorized by any candidate or candidates committee.,5
RNY Initiative,5
Priorities USA Action. (302) 469-3772. Not authorized by any candidate or candidate's committee.,5
Penry Gustafson for SC House,5
Partnership for Oregon Communities,5
"National Shooting Sports Foundation, Inc.",5
National Security Action,5
"Keyes for Wisconsin, Treasurer:  David Luebke",5
Kate Brophy McGee AZ - Senate,5
John Nutting for Maine House.,5
GO Public Schools Oakland Advocates,5
"Friends of Pinky Vargas (D) PO Box 3106, Bellingham, WA, 98227",5
Friends of Michael Guest,5
Friends of Meredith Wellington,5
Florida Senatorial Campaign Committee,5
Doug Carel for District Judge,5
Connecticut Education Association,5
Community Committee to Elect Robert Cohen,5
"Committee to Elect Susan K. McComas, Mary Lou Hoopes, Treasurer",5
"Committee to Elect Saydie Cook, Jim Smith Treasurer",5
Committee to Elect Kyle Guyton,5
"CTMT. David Desjardins, Treasurer. Approved by Joe Aresimowicz.",5
"Ashley Gaudiano 2018, Treasurer Heather Miller. Approved by Ashley Gaudiano.",5
"Abercrombie for State Rep., Nicole J. Barillaro, Treasurer.  Approved by Cathy Abercrombie.",5
"ACC Wisconsin PAC. Casey Stafford, Treasurer. Not authorized by any candidate or candidate's agent or committee.",5
#ProjectRedTX and not authorized by any candidate or candidate’s committee,5
 Paid for by Working for a Better Long Beach PAC  committee major funding from California Association of Realtors,5
the Maryland State Education Association,4
the Foundation for Independent Voter Education,4
the Arizona Education Association,4
William Timmons for Congress,4
Whitmire for US Congress,4
Wheatland Electric ,4
Washington State Democratic Party,4
Walt Wilkins for Solicitor,4
VOTE HEATHER CARTER SENATE,4
Upstate Conservative Victory Fund but not authorized by any candidate or candidate committee,4
Stonewall Democratic Club,4
Sean Bowie for State Senate,4
Ross Spano for Congress,4
Regina Cobb 2018 ,4
Perspective Wealth Planning,4
"Paid for by Markley For LG, William J. Stanley Treasurer, Approved by Joe Markley",4
"Paid for by Janet Nguyen for Senate, FPPC ID#1373835",4
Paid for by Dave Jones for Attorney General 2018,4
"Norm 2018, Lon Seidman Treasurer, Approved by Norm Needleman",4
NIXON 2018,4
Mal Hyman For Congress,4
Koop for Texas,4
"Kansans for a Democratic House, Adam Lusker, Treasurer",4
"Justice San Diego supporting Genévieve Jones-Wright for District Attorney 2018, sponsored by Alliance San Diego Mobilization Fund. Committee major funding from: Quinn Delaney",4
Jim Pikl for Justice Campaign,4
Jay Dean for Texas,4
Healthy Nevada PAC,4
Gino Filippi for Upland City Council 2018 ID#1329509,4
George Scott for Congress,4
Friends of Sean Quinlan,4
"Friends of Lenora Dawson; Timothy Dawson, EdD., Treasurer",4
Friends of Kent Glesener 2018,4
Friends of Dustin,4
"Friends of Clarence Lam; Pat Payne, Treasurer.",4
EarthX,4
Common Cause Georgia,4
Clean Energy Jobs Ohio,4
"Clark, Philipczak and Khona for Councul  38 Harrison Ave. East Brunswick, Nj 08816",4
Citizens for Rob Bailey,4
"Caroline Self for Senate, PO Box 714, Florence, AL 35631",4
Bredesen for Senate,4
Arizonans for Effective Leadership. Not authorized by any candidate. ,4
Arizona Parents for Education,4
Anita For Arizona ,4
Americans for Prosperity Foundation,4
American Federation of Teachers,4
Aitken for Anaheim Mayor 2018. FPPC # 1396743,4
the Bradley Committee.,3
the Beacon Center of Tennessee,3
"Yes on Measure I and Measure J, Move Pasadena Forward, A Committee Controlled by Mayor Terry Tornek",3
Women Vote,3
Williamson County GOP,3
Waymond Fermon for Indio City Council 2018 ID#1408840,3
UJA-Federation of New York,3
The Committee to Elect Erin Kelley,3
The Committee To Elect Martha Newton,3
The Canadiate Jim Warner for Mayor,3
TLR,3
"Sunlight Arizona, a program of the One Arizona, a non-profit 501(c)3 organization",3
"South Sound Women's Leadership PAC, PO Box 5304, Tacoma, WA 98415. No candidate authorized this ad. Top 5 Contributors: Janet Theissen, Chelsea Talbert.",3
"Scott Dianda for State Senate, PO Box 81, Calumet, MI 49913",3
"Save San Diego Neighborhoods, Inc.",3
SEIU Healthcare Illinois & Indiana,3
SCMORSEofCOURSE,3
Roby Helm,3
Riverhead Policy Group,3
Redmond School District,3
"Political advertisement paid for by the campaign to elect Debbie Wood  3011 20th Avenue Valley, Al. 36854",3
"Planned Parenthood of Advocates of Michigan | PO Box 15041, Lansing, MI 48901",3
"Paid for by Mantovani for STL, Tim Fogerty, Treasurer",3
Oregonians United Against Profiling,3
Olsen for Congress,3
North Wasco School District,3
Nancy Robbinson for Orange County School Board Chair (Nonpartisan),3
McLeod-Skinner for Oregon,3
"Maryland Republican Party, R.Christopher Rosenthal Treasurer",3
Maryland Consumer Rights Coalition,3
Manhattan Chamber of Commerce,3
Maloney for New York,3
Lennon for Boone ,3
Kentucky Family Values,3
Julie for Texas 25,3
John Knight for Senate,3
"John Kingston for Senate, Inc.",3
"John D. Moss Campaign, Candidate",3
JUSTIN FAREED FOR CONGRESS - FEC# C00572560,3
Gretchen Whitmer for Governor,3
Gahanna Underground,3
Future Scholar. Administered by State Treasurer Curtis Loftis. Not paid for with state funds.,3
Fryer for Arizona. Authorized by Kelly Fryer.,3
"Friends of Team 46 Slate. Chris Madaio, Treasurer",3
Friends of Russ Kenyon,3
Friends of Michela Skelton,3
Friends of Kirby Delauter,3
Friends of Dorothy Merritt,3
Friends of Chris Carr,3
Friends for Miller-Meeks,3
Friends for John Talley 2018,3
Freedom Partners,3
Floridians for a Fair Shake,3
Estes for Congress,3
Equality California,3
Delgado for Congress,3
"DCCC, 430 South Capitol St., SE, 2nd Floor Washington, DC 20003. Not authorized by any candidate or candidate's committee.",3
Colorado Liberty PAC,3
"Color of Change PAC, colorofchangepac.org, not authorized by any candidate or candidate’s committee. ",3
Colin Allred for Congress,3
Citizens For Harry He Assembly 2018,3
Carlisle for Senate. Approved by Wade Carlisle. ,3
CINDY HYDE-SMITH FOR US SENATE ,3
"Bill Lee for Tennessee, Inc. - Fred Decosimo, Treasurer",3
BRITE Coalition.,3
American Chemistry Council,3
the Democratic Party of Illinois,2
the Committee to Re-Elect Sheriff Bill Elder,2
"the Committee to Elect Melissa Gravitt for Circuit Court Judge, Tenth Circuit, Group 10",2
the Committee to Elect Jacob Ventura,2
Zumbach for Agriculture,2
York County Republican Party,2
Wyoming Electric Cooperative Association,2
Working Californians Against Corruption,2
"William Edward Smith Jr., 750 Turtle Cove Rd., Killen, AL 35645",2
Washington Education Association Political Action Committee,2
Vote Yes for 6A,2
Tim Greimel for Congress,2
The Robert McKay Campaign,2
The Greg Bonnen Campaign,2
Texans for Joan Huffman,2
Terrell N. Fritz,2
Tennessee Jobs Now,2
"THE MISSOURI BAR, SEBRINA BARRETT, EXECUTIVE DIRECTOR PO BOX 119 JEFFERSON CITY, MO 65102",2
"Svaty for Kansas, Shirley Jacques, Treasurer",2
Susan Ellenberg for Santa Clara County Supervisor FPPC# 1394541,2
Stand Up for Ohio,2
Servant Campaign Fund ,2
Scholten4Iowa Campaign Committee,2
Rob Richardson for Ohio Treasurer,2
Protect Freedom PAC,2
Pete King for Congress.,2
Pechefsky for Congress,2
"Paid for by Seth Levy for District Attorney, Chris McCarthy Treasurer, P.O. Box 31, Brunswick, ME",2
Paid for by Donald Branham for Sheriff,2
Oregon Education Association,2
No New Oklahoma Taxes,2
No Cuts to Care,2
Nicole George for Metro Council 21,2
Nick Josefowitz for Supervisor 2018,2
New York State Laborers' Union,2
New Direction PAC,2
Neville for Colorado,2
Muratsuchi for Assembly 2018.,2
Matt Lederer for State Assembly,2
"Kennedy 2018, Andrew Fowler Treasurer. Approved by Kathy Kennedy",2
Kellie Julia for State Senate District 15,2
Karl Dean for Governor,2
Kansas Electric Cooperatives ,2
John Wolfe for U.S. Senate,2
Jena Griswold for Colorado,2
Jake Ashby for New York State Assembly,2
Gary Bechtel for State Representative,2
"Friends of Sam Givhan, 100 Washington St., Huntsville, AL 35801",2
"Friends of Saif Rehman, Sana Rehman, Treasurer.",2
Friends of Rick Banks Committee,2
Friends of Mark Gordon,2
"Friends of James Howard, William C. Woodcock, Treasurer",2
Friends of Greg Babinec 2018,2
Friends of Eric Wray,2
Friends for Greg Waring,2
Fresno County Young Democrats,2
"Florida 32BJ United American Dream Fund, 1313 NW 36th Street Suite 501 Miami, FL 33142. Independently of Any Candidate. No Candidate Has Approved This Ad.",2
Faso for Congress,2
"Faculty for Our University's Future, a committee sponsored by the California Faculty Association. Not authorized by a candidate or committee controlled by a candidate.",2
FRIENDS OF S. ASHLEY NICKLOES,2
English Cameroon for a united Cameroon,2
Elect Kevin Payne,2
"Doug Underhill, Republican, Candidate for Escambia County Commission, District 2",2
DeGrazia for Arizona House,2
Dave Yost for Ohio,2
"DEMOCRATIC VICTORY FUND | PO BOX 407, MONTGOMERY, AL 36101",2
Cynthia Flores Campaign,2
Cullimore for Senate,2
Committee to Elect Jeremy Faison,2
"Committee to Elect Henry Gaudreau, PO Box 163, Chesaning, MI 48616",2
"Committee to Elect David Northcutt, P.O. Box 515, Montrose, AL 36559",2
Committee to Elect Alexis Hansen,2
Citizens for Secure Borders IEC,2
"Citizens for Scott Bryan, Alyssa Bryan, Treasurer",2
Citizens Alliance for Responsible Development (CARD),2
Chris Rahlf for Assembly,2
Campaign to Elect Rosalyn Glenn,2
CTE Summer Schmaling,2
"By Authority: Maryland House Democratic Caucus Committee; Gail E. Smith, Treasurer. ",2
Bob for Governor,2
Bilirakis for Congress,2
Batman for Assembly,2
American Civil Liberties Union,2
the Westchester-Playa Democratic Club.,1
the Republican Assembly Campaign Committee,1
the Office of Rep. Mike Johnson,1
the Office of Congresswoman Nita Lowey,1
the Alliance for Michigan Power,1
official funds authorized by the House of Representatives.,1
and Authorized by Ross for Phoenix Union,1
Zack Fields for State House ,1
Yellowhammer News,1
WPA Intelligence,1
Vote Nick Guy,1
Vote Mesnard,1
Virginians Against Tim Kaine,1
Tom Rice for Congress,1
The Office of Mayor Ted Wheeler ,1
The New Data Project.,1
The Commonwealth Foundation,1
"The Committee to Elect Bill Newman Mayor, Glenn Beech Treasurer",1
The Beer Institute,1
The Arc,1
"Texans for Senator John Cornyn, Inc.",1
Texans for Kelly Hancock,1
Stier Forward,1
State Representative Todd Stephens,1
South King County Deserves Better,1
South Central Power Co. ,1
Savage for Mayor Campaign,1
Satterwhite for Judge,1
"Sara Michael for Missouri, Maxwell Rademan Treasurer",1
SEIU on behalf of iAmerica Action,1
Ronald Gelok & Associates,1
Robert Nichols for Texas Senate,1
"Richard ""RK"" Kowalewitch for City Council",1
"Rhonda Lopez, Republican for State Representative, District 115",1
"Republican Party of Virginia, Inc.",1
Reliable Energy Policy,1
Ray Guillory for Escambia Co. School Board Dist.2,1
Raquel Caldwell ,1
Randy Ligon for State House,1
"Ralph Burke Campaign P.O. Box 1236 Gadsden, AL 35902",1
RT Transparency,1
Priorities USA Action and SMP. Not authorized by any candidate or candidate's committee.,1
"Political Adv. Paid for by Danielle Skidmore Campaign, Alicia Weigel, Treasurer; PO Box 13, Austin TX 78767. This campaign has not agreed to comply with the contribution and expenditure limits of the Austin Fair Campaign Charter.",1
"Phil Glynn for Mayor, Jon Otto, Treasurer.",1
Peter De Neufville For Congress,1
Perlmutter for Congress,1
Patriot Majority USA,1
"Paid for by Troy McDonald for Stuart City Commission, Group 3. ",1
Paid for by Oregon Forests Forever,1
Paid for by Friends of Andrew Jones,1
Our Lives Our Vote,1
Osage Valley Electric Cooperative ,1
Oconee County Democratic Party,1
No On Amendment 1,1
NextGen Climate Action,1
New York Republican Assembly Campaign Committee,1
Mountie Nation for Change,1
Mosiman for State Auditor,1
"Missourians For Mike Cierpiot, Fran Baker Treasurer.",1
Mike Shelton for County Assessor 2018,1
"Mike Hill Republican for Florida State House, District 1",1
"Melanie Hill for State Board of Education District 2, Treasurer Kelli Pylant, 109 Princeton Drive, Dothan, AL 36301",1
"Markley For LG, William J. Stanley Treasurer, Approved by Joe Markley",1
"Mark Yarbrough Campaign P. O. Box 1413 Athens, AL 35612",1
Lincoln Land Wind,1
Leonore M. Greller,1
"Lee Boan for Sheriff, P.O. Box 4, Lugoff, SC",1
Lazarus for Chair,1
Kaump for Wisconsin,1
Kathleen Rice for Congress,1
"Kansas Senate Democrats Committee, Will Lawrence, Treasurer",1
Josh Hill for Oregon,1
Jonathan Boos For State Representative Campaign,1
Johnson for Governor,1
John Carter for Congress,1
Jermey Ottaway For Marquette City Commission,1
Jennifer Plumb Committee to Elect,1
"Jennifer Boddicker Ph.D., Democrat for Florida State House District 80",1
"Jefferson County Democratic Party, Box 10522, Birmingham 35202",1
"Jamie Kiel Campaign 14696 Hwy 43, Russellville, AL 35653",1
James Talarico Campaign,1
James Smith for South Carolina.,1
James Ramos for Assembly,1
Jake Brown for Mesa,1
"JM Knapp, not authorized by any campaign or campaign committee",1
Isaiah Knight,1
Horizon PAC,1
Hora for Senate,1
Hillsborough County Democratic Executive Committee,1
Hampton Roads Green Party,1
HIGHTOWER FOR ALABAMA,1
Grego for House 2018 ,1
Geoff Duncan for Georgia,1
Gene Fuss,1
"Garlan Gudger for State Senate 314 2nd Ave SE, Cullman, AL 35055",1
Gabriel Nila Campaign,1
Friends of Susanne Henderson,1
Friends of Susan Lynn,1
"Friends of Scott Goldberg, Andre Smotherman, Treasurer",1
Friends of Rushern Baker III,1
Friends of Rich Funke,1
Friends of Paul Ferro,1
Friends of Nathan Farnor,1
Friends of Natalie Iwasa,1
Friends of Lisa Callan,1
Friends of Lily Qi,1
Friends of John Olszewski Jr.,1
"Friends of Joel Rubin - Samuel Agger, Treasurer",1
Friends of Joe Fain,1
Friends of Jeremy Shaffer,1
Friends of Emily Brewer,1
"Friends of David Ryden. Taylor Gomez, Treasurer.",1
Friends of Ari Espinal,1
"Friends of Andrew Friedson, Brian Ashin, Treasurer",1
Friends of Aaron Gladd,1
Freedom Action Network of South Carolina,1
"For the purpose of this brochure, a “disclaimer” notice is defined as a statement placed on a public communication that identifies the person(s) who paid for the communication and, where applicable, the person(s) Sahak Nalbandyan & Solar Solutions authorized the communication.",1
Florida Sunlight Project,1
Fight for $15,1
Esparza for Fresno City Council ,1
Eric Graben for Congress.,1
"Elect Ryan Berman - 2525 S. Telegraph Rd, Ste 100, Bloomfield Hills, MI 48302",1
Elect Lori Saldana for Supervisor,1
Elect Kathy Hoffman for Superintendent; Authorized by Kathy Hoffman,1
Elect Jerry Long,1
Ehr for Congress,1
Education Voters of PA,1
Day for GA General Assembly District 007,1
"David Mann for State Representative, 149 Silverbrook Avenue, Niles, MI 49120",1
David Kim for Congress,1
Craig Ford Campaign,1
Cournoyer for Senate,1
"Committee to Elect Jerry Sexton, Terry Winstead Treasurer",1
Committee to Elect James Dixon Sheriff of Chesterfield County,1
Committee to Elect Emily Best,1
"Committee for Life, Liberty and Property ID#1404971",1
Citizens for Saladino,1
Citizens for Rich Horton,1
"Citizens for James Ward Morrow - Paul Trumble, Treasurer",1
Citizens Supporting Jeff Fine,1
Citizens For Tom Basile,1
Chris Wilhelm for County Council,1
Chris Brown,1
Children's Action Alliance,1
Chemung County Legislator Rodney J. Strange,1
Chad Nugent Campaign Fund,1
Cathy Costello for Labor Commissioner,1
Casey Cagle for Governor,1
"Campaign for Jason Hunt 8535 Edna Ave Ste 100 Las Vegas, NV 89117 (702)370-0006",1
Campaign Fund For Calen Studler,1
California Life Sciences Association,1
"CTE Winnie Brinks for Senate, 2060 Osceola Dr SE, Grand Rapids, MI 49506",1
Boyer for Senate.,1
Boone Electric Cooperative,1
"Boog Highberger for State Representative, Galenea Miller, Treasurer.",1
Bob Lucey for County Commission 2,1
Bluestem Electric Cooperative ,1
Authority Fredericks for Maryland; Fay Fredericks Treasurer,1
Andy Cole for State Representative,1
Andrew Cuomo for Governor,1
Affordable Housing Now Yes on Props 1 & 2 Coalition,1
Advance California,1
A Step Ahead Chattanooga,1
" Friends of Angela Alsobrooks, Kimberly Seymour, Treasurer",1
اهل الرافدين في اميركا,0
"uInterview, Inc.",0
theSkimm,0
the committee to elect Mike Lee for NC House District 65 ,0
the committee to elect Gary Weaver,0
the committee Dean Arp for NC House,0
the candidate.,0
"the White Coat Waste Project, Inc",0
the WNBA,0
"the Voter Awareness Project and not authorized by any candidate or candidate's committee. Voter Awareness Project. 1714 Franklin Street Suite 100166 Oakland, CA 94612",0
the Vincent Committee.,0
the United States Holocaust Memorial Museum ,0
the Trump Make America Great Again Committee,0
the Tommy Luckadoo for School Board Committee,0
the Southern Coalition for Social Justice,0
the Rusteika Committee.,0
the Republican National Committee,0
the Progressive Change Campaign Committee PAC and not authorized by any candidate or candidate's committee. Contributions to the PCCC are not deductible as charitable contributions for federal income tax purposes.,0
the Progressive Change Campaign Committee PAC (BoldProgressives.org) and not authorized by any candidate or candidate's committee. Contributions to the PCCC are not deductible as charitable contributions for federal income tax purposes.,0
the Paulette Jordan Campaign,0
the North Carolina Democratic Party. Authorized by Simon for NC House,0
the North Carolina Democratic Party. Authorized by Ric Vandett for NC Senate,0
the North Carolina Democratic Party. Authorized by Committee to Elect Vernon Moore NC State Senate District 10,0
the North Carolina Democratic Party. Authorized by Committee to Elect Caroline Walker,0
the North Carolina Democratic Party. Authorized by Citizens for JD Wooten,0
the North Carolina Democratic Party. Authorized by Campbell for North Carolina Senate,0
the North Carolina Democratic Party and Wiles for House,0
the North Carolina Democratic Party and Tim Barnsback for North Carolina House.,0
the North Carolina Democratic Party and The Committee to Elect Marcia Morgan.,0
the North Carolina Democratic Party and The Committee to Elect Aimy Steele.,0
the North Carolina Democratic Party and Simon for NC House.,0
the North Carolina Democratic Party and Simmons for NC House.,0
the North Carolina Democratic Party and Sam Edney for NC House.,0
the North Carolina Democratic Party and Rixon for NC House 9.,0
the North Carolina Democratic Party and Rhonda for NC.,0
the North Carolina Democratic Party and Penelope Ann DiMaio 4 State House.,0
the North Carolina Democratic Party and Linda Bennett for NC House 26.,0
the North Carolina Democratic Party and Langley for NC House.,0
the North Carolina Democratic Party and Kuppers for Senate.,0
the North Carolina Democratic Party and Kim Bost for NC House,0
the North Carolina Democratic Party and Garner for North Carolina.,0
the North Carolina Democratic Party and Gail Young for North Carolina.,0
the North Carolina Democratic Party and Frank Deese for North Carolina.,0
the North Carolina Democratic Party and Dianne Little for NC House.,0
the North Carolina Democratic Party and Committee to Elect Terri Legrand.,0
the North Carolina Democratic Party and Committee to Elect Joe Webb NC Senate 6.,0
the North Carolina Democratic Party and Committee to Elect Jean Sivoli.,0
the North Carolina Democratic Party and Committee to Elect Isaiah (Ike) Johnson.,0
the North Carolina Democratic Party and Committee to Elect Helen Probst Mills.,0
the North Carolina Democratic Party and Committee to Elect Helen Probst Mills,0
the North Carolina Democratic Party and Committee to Elect Caroline Walker.,0
the North Carolina Democratic Party and Citizens for JD Wooten.,0
