Muratsuchi for Assembly 2018.,4
Montanans for Tester,4
Michael Dougherty for District Attorney,4
Matt Hall for Mayor 2018,4
"Maine Conservation Voters Action Fund, 295 Water St. Ste. 9, Augusta, ME 04330. NOT PAID FOR OR AUTHORIZED BY ANY CANDIDATE.",4
Maine Coast Heritage Trust,4
Jonathan Boos For State Representative Campaign,4
Jackson for US Senate,4
Human Rights Watch,4
Friends for Dave Ettman,4
FreedomWorks for America. Not authorized by any candidate or candidate's committee.,4
Forward With Flynn,4
Florida Forward PAC,4
"Elect Mae Flexer, Ussawin R. Bumpen, Treasurer. Approved by Mae Flexer",4
Ehr for Congress,4
"Dr. Jeff Colyer for Governor, Howard Wizig, Treasurer",4
Democratic Socialists of America,4
Committee to Elect Tahirah Amatul-Wadud,4
Committee to Elect Rick Olson To House of Representatives,4
"Committee to Elect Mat Pitsch State Senate, District 8",4
Christopher Hale for Tennessee,4
Cathy for Congress,4
Casey Welch for Congress,4
Carolyn for Congress,4
CARE,4
Building New York's Best,4
"Anthony Bonna, Republican, for St. Lucie County Commission - District 2",4
Alliance for a Better Minnesota Action Fund. Not Coordinated With Or Approved By Any Candidate Nor Is Any Candidate Responsible For It.,4
Al Lawson for Congress,4
Aitken for Anaheim Mayor 2018. FPPC # 1396743,4
 Paid for by Working for a Better Long Beach PAC  committee major funding from California Association of Realtors,4
the Women's Equality Party,3
the New Jersey Education Association. ,3
the House Republican Organization,3
"and prepared by the Committee to elect Elliott Nickell, 445 Minnesota Street, Suite 1500, Saint Paul, MN 55101.",3
Vocal,3
Unite Colorado Election Fund,3
The Greg Bonnen Campaign,3
The Committee For Ranked Choice Voting,3
"Tallahassee Reports, a 501(c)3 non-profit media organization.",3
Stitt for Governor 2018,3
State Innovation Exchange,3
Stabenow for U.S. Senate,3
Smith for Senate,3
Shawn Nelson For Congress,3
Save the Children US,3
Savage for Mayor Campaign,3
Salazar for State Senate,3
Rocklin Citizens for Quality Parks Yes on Measure A FPPC #1406322,3
Republican Committee of Lancaster County,3
Rene Lopez for Chandler,3
Rebecca Koelzer candidate for FL house District 4,3
Progressive Consulting Strategies,3
ProgressNow Colorado,3
Politicon,3
Planned Parenthood Action Fund.,3
Petrie-Norris for Assembly 2018 ,3
People For the American Way,3
"Paid for by Matt for State Senate, Gene P. Nocera Treasurer; Approved by Matt Lesser",3
Paid for by Hubbell for Governor,3
"Paid for by Committee to Elect Rhya Marohn, Connie Bowling, Treasurer",3
"PSEA and our 181,000 proud school employees that make our public schools work.",3
"Mike Hill Republican for Florida State House, District 1",3
"Larry Hogan for Governor, R. Christopher Rosenthal, Treasurer",3
Know Colorado,3
Kentucky Tomorrow. Not Authorized by any candidate or candidate’s committee.,3
Kentucky Family Values,3
Kansas Electric Cooperatives ,3
"Judge Pam Derbyshire Campaign, Larry Finder, Treasurer, PO Box 2194, Bellaire TX 77402-2194, in compliance with the voluntary limits of the Judicial Campaign Fairness Act.",3
John Soldati for Superior Court Judge 2018,3
"Joe Shirley, Jr., for President 2018",3
International Assn of Firefighters Local 1784 PAC,3
Heidi for North Dakota,3
Harpootlian for Senate,3
Geoff Duncan for Georgia,3
Gaughran 2018,3
Friends of the Earth,3
"Friends of Tommi Makila (Dionne A. Makila, Treasurer)",3
"Friends of Saif Rehman, Sana Rehman, Treasurer.",3
Friends of Nicholas Mattiello ,3
Friends of Marty Quinn Senate 2018,3
Friends of Dana Beyer,3
Forward Majority Action 527 PA PAC. Not authorized by any candidate or candidate’s committee.,3
"Electioneering Communication By Help Trump Secure The Border 800 Ocala Road, Suite 300-235, Tallahassee, FL 32304",3
"Educate Our Kids, We Are Grinnell.",3
EDF Action,3
"Doucette for CT-13, Josh Howroyd, Treasurer. Approved by Jason Doucette.",3
Donnelly for Indiana,3
Discover Charter Schools,3
DiNicola for Congress,3
Cort Vanostran for Congress,3
Casey Cagle for Governor,3
Candidate,3
Californians for More Affordable Homes and Quality Public Schools committee major funding from California Building Industry Association and EdVoice. Not authorized by a candidate or a committee controlled by a candidate.,3
Caleb Frostman for State Senate,3
CALinnovates,3
Brady PAC,3
"Boucher for CT, Ellen Essman, CPA, Treasurer. Approved by Toni Boucher",3
Bishop for Cherry Hills Village,3
Aftab for Ohio,3
ANT,3
AFSCME Council 31,3
A New Day for New Hampshire,3
" Hegeman for Senate, Glen Klippenstein, Treasurer.",3
the North Carolina Democratic Party and Ric Vandett for NC Senate.,2
the North Carolina Democratic Party and Committee to Elect Vernon Moore NC State Senate District 10.,2
the North Carolina Democratic Party and Committee to Elect Helen Probst Mills.,2
"the House Victory Committee | Ashley Manlove, Treasurer ",2
the Democratic Party of Illinois,2
"the Committee to Elect Tom Young Circuit Judge, Group 26",2
the Committee to Elect Kate Campanale,2
Zuckerman for Vermont,2
"Working Assets Funding Service, Inc. on behalf of itself and its affiliate, Credo Mobile, Inc.",2
Wesley Harris for NC,2
Wendy Rogers for Congress,2
"Weatherspoon for TN Senate, District 31.  Martha Frizzell, Treasurer.",2
Washington Education Association Political Action Committee,2
"Vote Helga Luest - Jennifer Sinclair, Treasurer",2
Tipmont REMC ,2
Theo Ellington for Supervisor 2018,2
Tewksbury Republican Town Committee,2
Students for Life of America,2
"Strong Economy for All, a fiscally sponsored project of Center for Popular Democracy",2
Steven Buccini for State House,2
Sponsored By The Florida Republican Senatorial Campaign Committee,2
Solar Rebates,2
Shareblue Media,2
SEIU on behalf of SEIU Florida,2
"Ryan Torrens, Democrat for Attorney General",2
Rory's Committee,2
Rodriguez for Yorba Linda City Council (FPPC ID 1402990),2
"REGULATED FUNDS BY MICHIGAN PLANNED PARENTHOOD VOTES SUPER PAC, P.O. BOX 15041, LANSING, MI 48901. NOT AUTHORIZED BY ANY CANDIDATE OR CANDIDATE’S COMMITTEE.",2
Public Service Proud,2
Priorities USA Action and Senate Majority PAC. Not authorized by any candidate or candidate's committee.,2
Patriot Majority USA,2
Paid for by the Ohio Education Association,2
"Paid for by Marsy’s Law for Wisconsin, LLC",2
North Wasco School District,2
NextGen Climate Action,2
National Wildlife Federation Action Fund,2
Nathan Fletcher For Supervisor 2018,2
NIXON 2018,2
"MoveOn.org Political Action, pol.moveon.org, not authorized by any candidate or candidate's committee.",2
Mikos for Mayor,2
Mike Shelton for County Assessor 2018,2
Matt Haggman for Congress,2
Mae Beavers for County Mayor,2
MAST FOR CONGRESS,2
Lois Schipper for State Senate,2
Lisa Brown for Congress,2
"Lennon for Boone | Nila Gupta, Treasurer",2
Kate Brophy McGee AZ - Senate,2
Karen Mayne for Utah Senate 5,2
Kanew for Congress,2
Justice Douglas Lang for Chief Justice Campaign,2
Justice Brett Busby Campaign,2
John Carter for Congress,2
Jim Beck for Georgia,2
Hurd for Congress,2
Human Rights Campaign PAC,2
Howard Wesson for County Commissioner Dist. 4,2
House Victory PAC and not authorized by any candidate or candidate's committee. ,2
Holler Creative Company LLC,2
Hagenow for Iowa House,2
Golden for Congress,2
Friends of Josh Green,2
Friends of Dave Valesky,2
Friends of Dan Milleson,2
"Friends of Dan Medinger, Bryan Coster, Treasurer",2
"Friends of Clarence Lam; Pat Payne, Treasurer.",2
Friends of Chris Murphy,2
Friends of Amanda Septimo,2
Friends of Aloyse Brown,2
Friends of Adrian Plank,2
Florida Public Utilities,2
"Flaherty for Judge, PO Box 40390, Saint Paul, MN 55104",2
"Emma Collum, Democrat for Florida House 93",2
Elect Smith For Sheriff Campaign,2
Education Matters PAC. Committee major funding from Steve & Susan Chamberlin,2
David Kim for Congress,2
"Dave Myers For Sheriff, 2018",2
Dane Eagle for State Representative. ,2
Cournoyer for Senate,2
Corrections Tough,2
Colorado Moms Who Care,2
Colin Allred for Congress,2
Clean Power Virginia ,2
"Citizens for Jerry Nolte; Alicia Nolte, Treasurer",2
Charles McCall,2
Castaldo for Freeholder | 36 Central Ave. Old Bridge NJ 08857,2
Care Voters of Minnesota,2
Californians for Safe and Affordable Housing,2
CalChamber and the Civil Justice Association of California,2
"Brent Moody for State Representative, Austin McMullin, Treasurer",2
"Ben McKee for Montana (D) • PO Box 22701 • Billings, MT 59104",2
Anthony Sudweeks for Utah State House,2
America for Early Ed,2
AFSCME and AFSCME Council 5 PEOPLE Fund ,2
" Friends of Angela Alsobrooks, Kimberly Seymour, Treasurer",2
the Republican Party of Iowa. Approved by Hora for Senate.,1
the North Carolina Democratic Party and Simon for NC House.,1
the North Carolina Democratic Party and Rixon for NC House 9.,1
the North Carolina Democratic Party and Kim Bost for NC House,1
the Louisiana Chemical Association,1
the Lashar for Congress Committee,1
the Garrett for Statehouse Committee ,1
the Communications Workers of America,1
"the Committee to Elect Vivianne Del Rio for Miami-Dade Circuit Court Judge, Group 14",1
the Committee to Elect Shane Sandridge,1
the Committee to Elect Julia Springsteen,1
"the Committee to Elect Elisabeth Espinosa, and the candidate, Non-Partisan, for Miami-Dade Circuit Court Judge (11th Judicial Circuit), Group 8",1
and approved by Carol Boston.,1
and Authorized by Gary Jones for Governor 2018,1
"Yes on C, Watershed & Oak Woodland Protection Committee",1
"Wyatt Burk for Circuit Court Judge, Charles W. McDonald, Treasurer",1
Williamson County GOP,1
Vote Kern House 2018,1
Victor Kocher,1
"Vance Aloupis, Republican, for State Representative, District 115.",1
Valerie N. Hefner for a Blue 62,1
Upton for All of Us.,1
Union Patriots,1
Trey Caldwell for State House 2018,1
Treasure Coast Conservatives,1
Tom Umberg for Senate 2018 FPPC ID #1403029,1
Toledo Ward 18 Chairman Kenneth Colditz,1
"Tho Bishop, Private Citizen",1
"The Urbina Law Firm, LLC",1
The Surfrider Foundation,1
"The Haggerty Committee, 32 Leonard St., Woburn, MA 01801",1
The Committee To Elect Lisa Ring,1
"Teri Banas for State House, Angela Wilson, Treasurer | 5606 Creekwood, Haslett MI 48840",1
Tennesseans For Quality Early Education PAC,1
Stronger Foundations,1
Steve Smith for Congress ,1
Steve Moss for Bay County School Board District 5,1
Society & Purpose,1
Smart Cities Prevail.,1
Sierra Nevada Revolution,1
Seaman for KY House,1
SOLAR ENERGY TODAY,1
SEIU on behalf of iAmerica Action,1
Right Call Media LLC,1
Right Call Media,1
Portside,1
Planned Parenthood Action PAC North Carolina. Not authorized or in coordination with any campaign.,1
Phillips for Delegate Committee,1
Phil Thompson for Iowa ,1
Pete King for Congress.,1
Patrons of Jeff Porter,1
"Paid for by Seth Levy for District Attorney, Chris McCarthy Treasurer, P.O. Box 31, Brunswick, ME",1
"Paid for by Mantovani for STL, Tim Fogerty, Treasurer",1
"Paid by J. Walker Wilson, for Escambia County School Board",1
Orange County Coastkeeper,1
Ohio Senate Democrats,1
Ohio Legislative Black Caucus Political Action Fund.,1
Norgaard4AZ,1
No on Lodi Measure L,1
National Security Action,1
"Nathaniel J. Mcfadden for Senate, John Etoh, Treasurer",1
NYS SRCC,1
MoveOn.org Civic Action.,1
Metro Puerto Rico ,1
Mendoza for Senate 2018 #1373700,1
"Melissa Howard, Republican, for Florida House of Representatives, District 73",1
Meitiv for Montgomery,1
Megan Beaman Jacinto for Coachella City Council 2018,1
"Matt Spritz, Republican, for State Representative",1
Matt Lynch For Judge,1
"Matt Blumenthal for State Representative. Jackie Heftman, Treasurer. Approved by Matt Blumenthal.",1
Marylanders for Craig Wolf,1
Marion County Young Democrats,1
Larry Smith for McNairy County Mayor,1
LD15 Democrats. Approved by Julie Gunnigle.,1
Kevin Daley for State Senate,1
Kaump for Wisconsin,1
Katie Porter for Congress,1
Josh Gottheimer for Congress,1
"Jose Pepe Diaz for Miami-Dade County Commissioner, District 12",1
John Wolfe for U.S. Senate,1
Joan Fischer for Charlotte County Commissioner,1
Jessica Morse for Congress,1
Jennifer Plumb Committee to Elect,1
Jason Rittereiser for Congress,1
"Jason Haeseler, Democrat for Florida House District 21",1
JB Akers for Mayor,1
"J. Gordon Shuler, non partisan candidate for Franklin County Judge. ",1
Idaho Conservation League,1
I Care,1
Huges for Iowa ,1
Henderson for State House Campaign,1
Healthy Nevada PAC,1
Healthcare for All Virginians,1
Heady Coleman for State Senate 2018,1
"Hatfield 2018. Loretta Chory, Treasurer. Approved by Susan Hatfield. ",1
Hallie Thompson for Congress,1
Gerry Connolly for Congress,1
Gavin Newsom for Governor,1
"Friends of Thomas Morgan, 1432 Wickham, Lansing, MI 48906",1
Friends of Nero,1
Friends of Mary Auker-Endres,1
Friends of Lucy McBath,1
Friends of Joe Sam Queen,1
Friends of James Skoufis,1
"Friends of James Howard, William C. Woodcock, Treasurer",1
"Friends of Hiruy Hadgu, Aman Hadgu, Treasurer",1
Friends of Ernest T. Little for State Representative District 4,1
Friends of Elizabeth Helgelien,1
Friends of Didi Barrett for Assembly,1
Friends for Karen 38,1
Friends for Greg Waring,1
"Friends Of Shaul, Scott Brothers Treasurer.",1
Frank Polo's Campaign,1
Florida Sunlight Project,1
Florida Republican Senatorial Campaign Committee,1
"Firelands Electric Cooperative, Inc. ",1
Fighting for Our Future. This communication was not expressly authorized or requested by any candidate or by any candidate's political committees or any of its agents.,1
Families For Nathan Dahm,1
Evan Glass for Montgomery County Council ,1
"Eva for CT. Chris Soto, Treasurer. Approved by Eva Bermudez Zimmerman",1
"Eric Zahnd for Platte County Prosecutor, Dana Babcock Treasurer.",1
Equality Texas.,1
Environmental Voter Project,1
Environmental League of Massachusetts Action Fund,1
Elect Lori Saldana for Supervisor,1
Don Davis for NC Senate.,1
"Dominic For Senate, Michele Berardo, Treasurer. Approved by Dominic Rapini ",1
Deborah M. Hooker for County Court Judge ,1
Dean Phillips for Congress,1
Darrell Weaver for State Senate 2018,1
Danny Glidewell Republican for County Commission District 2,1
Dale Stalf for Judge,1
"Congressman Neal Dunn, M.D.",1
Committee to Elect Scott Cepicky- Treasurer Beverly Simmons,1
Committee to Elect Rosabelle Gorman,1
Committee to Elect Rob Davidson,1
Committee to Elect Ray Leonard Clerk-Recorder-Assessor 2018,1
"Committee to Elect Padma Kuppa, P.O. Box 1874 Troy, MI 48099",1
Committee to Elect Brian Darling Judge,1
Colorado Liberty PAC,1
"Color of Change PAC, colorofchangepac.org, not authorized by any candidate or candidate’s committee. ",1
Citizens Clean Elections Commission,1
Christian Ramirez for San Diego City Council 2018,1
Children's Action Alliance,1
Chesapeake Bay Foundation,1
CITIZENS FOR ENERGIZING MICHIGAN'S ECONOMY,1
Bryan Zilonis,1
Brindisi for Congress,1
Brian White for State House,1
Bob Rackleff,1
Bloomberg Philanthropies,1
Billy Kovacs for Congress,1
Bill Schuette for Governor,1
Bigger Pie Forum,1
"Ben Albritton, Republican, for State Senate District 26",1
Barnett for Governor. Ronald Ramberg Treasurer.,1
Audrey Denney for Congress,1
Armenian National Committee of America-Western Region,1
Aric Nesbitt for State Senate,1
"Anna V. Eskamani, Democrat, for Florida House 47",1
Andy Holt For State House,1
American Federation of Teachers,1
American Civil Liberties Union,1
"Amanda Webster, New For 62. Brandon Webster, Treasurer. ",1
Alyse Galvin,1
Advance California,1
ALLIANCE OF AUTOMOBILE MANUFACTURERS,1
 Patients And Caregivers To Protect Dialysis Patients,1
yourNEWS Media Group Inc. ,0
truth,0
three American friends who care,0
"the White Coat Waste Project, Inc",0
the Wabasha County Republicans,0
the WNBA,0
the Voter Awareness Project and not authorized by any candidate or candidate's committee. (707) 241-4996. ,0
the Vincent Committee.,0
the Tuscaloosa County Democratic Party,0
the Trump Make America Great Again Committee,0
"the Rodney Sullivan Campaign, 5901 6th Avenue Northport, AL 35473",0
the Republican National Committee,0
the North Carolina Democratic Party and Tim Barnsback for North Carolina House.,0
the North Carolina Democratic Party and Tim Barnsback for NC House.,0
the North Carolina Democratic Party and The Committee to Elect Marcia Morgan.,0
the North Carolina Democratic Party and The Committee to Elect Aimy Steele.,0
the North Carolina Democratic Party and Sam Edney for NC House.,0
the North Carolina Democratic Party and Rhonda for NC.,0
the North Carolina Democratic Party and Langley for NC House.,0
the North Carolina Democratic Party and Kuppers for Senate.,0
the North Carolina Democratic Party and Jen Mangrum for NC.,0
the North Carolina Democratic Party and Garner for North Carolina.,0
the North Carolina Democratic Party and Gail Young for North Carolina.,0
the North Carolina Democratic Party and Don Davis for NC Senate.,0
the North Carolina Democratic Party and Dianne Little for NC House.,0
the North Carolina Democratic Party and Committee to Elect Terri LeGrand.,0
the North Carolina Democratic Party and Committee to Elect Jean Sivoli.,0
the North Carolina Democratic Party and Citizens for JD Wooten.,0
the North Carolina Democratic Party and Chad Stachowicz for NC.,0
the National Women's Law Center,0
the National Network of Abortion Funds,0
the National League of Cities,0
the National Center for Transgender Equality Action Fund,0
the NRCC and not authorized by any candidate or candidate's committee. www.nrcc.org,0
the NRCC and not authorized by any candidate or candidate's committee.,0
"the Keith Ellison for Attorney General committee, PO Box 80824, Minneapolis, MN 55408",0
"the Joe Lovvorn Campaign, 515 Ogletree Rd, Auburn, AL 36830",0
the Foundation for Independent Voter Education,0
the Foundation for Constitutional Government,0
the Florida Democratic Party. Not authorized by any candidate or candidate's committee.,0
the Democratic National Committee,0
"the Democratic Association of Secretaries of State, 777 S Figueroa Street Suite 4050 Los Angeles, CA 90017, Not authorized by any candidate or candidate’s committee. Nellie Gorbea, Treasurer, is a registered agent of Democratic Association of Secretaries of State.",0
the DSCC,0
the Conservative Life,0
"the Committee to Re-Elect Tim Choate, 181 Island Drive, Gadsden, AL 35901",0
the Committee to Elect Zaragoza for I.I.D. Director Division #5 2018,0
"the Committee to Elect Spiro, 2153 Government St. Mobile, AL 36606",0
"the Committee to Elect Sonny Steen, 203 Hollywood Road, Gadsden, AL 35901",0
"the Committee to Elect Ronda Walker, P.O. Box 3403 Montgomery, AL 36109",0
"the Committee to Elect Nancy Carlton Bendinger, P.O. Box 1869, Auburn,AL 36831",0
the Committee to Elect Maurice Horsey,0
"the Committee to Elect Mary Scott Hunter, PO Box 18572, Huntsville, AL 35804",0
the Committee to Elect Jacqueline Gray Miller,0
the Committee to Elect Dan Koh,0
"the Committee to Elect Carolyn Parker, 2600 E. Meighan Blvd., Gadsden, AL 35903",0
the Colorado Times Recorder,0
the Center For American Entrepreneurship.,0
"the Campaign to Elect Bill Veitch for District Attorney. P.O. Box 81 Birmingham, AL 35142",0
the American Kidney Fund,0
the ASPCA,0
the ACLU,0
reclaim the american dream - 501(c)3 - IRS certified ,0
pol adv Mari Montgomery,0
official funds authorized by the House of Representatives.,0
"mitú, Inc.",0
john deprospo,0
jason sullivan,0
"iSideWith, LLC",0
friends of John Michael Montgomery 2017,0
"friends of Joe Faust, 20452 Beecher Street, Fairhope AL 36532",0
freinds to elect jones 27,0
"candidate for District 5 City Representative Kizito ""Zito"" Ekechukwu treasurer Becky Rodriguez",0
"by GroundUp. Not authorized by any campaign, committee, or PAC.",0
"by CTMT. David Desjardins, Treasurer. Approved by Chris Conley.",0
"approved, and maintained by the committee of responsible persons to elect Gloria Walker Circuit Court Judge, Group 8, non-partisan.",0
and authorized by Janet Mills for Governor.,0
and Authorized by  Andrew Janz for Congress.,0
act.tv,0
"a private citizen and not authorized by any candidate or candidate's committee""",0
"Zya, Inc. ",0
Zumbach for Agriculture,0
"Zito Media. We are a Cable, Phone and Internet Provider. Pricing, equipment availability, services available, and internet speeds vary based on location. ",0
ZERO - The End of Prostate Cancer,0
Young America's Foundation,0
Yes for Affordable Housing,0
Yes She Can,0
XSTRAW,0
X Social Media LLC,0
Wyoming Wildlife Advocates,0
Wyoming Hunters and Anglers Alliance 501 (c) (4),0
Working Families Party,0
Word Brothel,0
Woodhull Freedom Foundation,0
WomenStrong International,0
"WipeRecord, a division of Eastman Meyler, PC",0
"Winning For Women, Inc.",0
"William Edward Smith Jr., 750 Turtle Cove Rd., Killen, AL 35645",0
Will Markusen,0
Wild Planet Limited,0
WhyHunger,0
Whitney Webb,0
White Buffalo LLC,0
West Virginia Strong,0
"Wes Edwards, as private citizen",0
Weninger for AZ.,0
WeLoveTrump,0
We Stand For USA,0
We Built This,0
We Are The Mighty,0
Water Lifestyle Co.,0
Washington State Democratic Campaign,0
Voters in Charge,0
VoteVets Action Fund,0
Vote Yes! for Success,0
Vote Mesnard,0
Vote Amber Selman-Lynn,0
Voice Big,0
VICELAND,0
UsAgainstAlzheimer's,0
Urie For State Rep,0
Unity 5k,0
United Press International,0
Unite America Inc.,0
Unitarian Universalist Service Committee,0
USA for UNHCR,0
USA Flagwear,0
US Lending Marketplace,0
UNICEF USA,0
"Tunji Williams, Treasurer ",0
TrumpStarSticker,0
"Trump 2020 Wear - Apparel Store not associated with the Trump campaign.  This is not a political page directly, we just sell shirts, hats etc.   Our ads will not relate directly to politics or an issue or national importance, just promoting products.  Thx",0
Triangle Blade,0
TradeVistas,0
Trade for America,0
Traci Stephens,0
Torn Wires Limited Liability Company,0
"Tony for Wisconsin. Connie Hutchison, Treasurer.",0
Tony for Wisconsin. ,0
"Tony Rackauckas for District Attorney 2018, FPPC ID# 970780",0
"Tony Guerrera for Senate. Sandy Nafis, Treasurer.",0
Tom Malinowski for Congress,0
Tom Butler for Senate,0
"Todd Greeson for Circuit Clerk, PO Box 159 Ider, AL 35981.",0
Tishomingo County For Chris McDaniel,0
Tina Smith for Minnesota,0
Tim Greimel for Congress,0
Tim Brown for Coffee County Mayor,0
"ThoughtFull Enterprises, Inc.",0
Third Factor,0
TheWrap,0
The committee to elect Wendy Sellars,0
The Welcome. Campaign,0
The Vegan Vibe,0
The Unofficial Bill O'Reilly Fan Club,0
The University of Chicago,0
The United Democratic Club,0
The Story of Stuff Project,0
The Southern Environmental Law Center ,0
The Social Justice Foundation,0
The Rutherford Institute,0
The Rights Party,0
The Right Way,0
The Refugee Center Online,0
The Re-elect Thomas Worthy Campaign,0
The Pragmatic Libertarian,0
The Poor People's Campaign: A National Call for Moral Revival,0
The Plastic Shark,0
The People for Cary Baldwin,0
The Partnership for Affordable Clean Energy (PACE),0
The Other Side of Texas,0
The Niskanen Center,0
The Maura Healey Committee,0
The Libertee Company,0
The Libertarian Coalition,0
"The Jim Carns Campaign, P.O. Box 43797, Birmingham, AL 35243 ",0
The International Fellowship of Christians and Jews,0
The Hope Necklace,0
The Hill,0
The Heritage Foundation ,0
The Finance Advice Org,0
The Fighting Forces,0
The Epoch Times,0
The Dude's Designs,0
"The Commonwealth Fund, a nonpartisan organization",0
The Committee to Re-elect Commissioner George Bowman,0
"The Committee to Elect Will Benton, P.o.Box 185 Cottondale, Al 35453",0
"The Committee to Elect Robert Kennedy, Jr. to U.S. Congress",0
The Committee to Elect Robert Briggs,0
The Committee to Elect Mike Soter,0
The Committee to Elect Mark Pettway,0
The Committee to Elect Linda Hall,0
"The Committee to Elect Jim Toomey, Birmingham Alabama",0
"The Committee to Elect Eric Bromwell, Stacie Canapp, Treasurer",0
The Committee to Elect David McCarty,0
"The Committee to Elect Darrell Turner. P.O. Box 671, Heflin, Alabama 36264",0
The Committee to Elect Corey Gingerich,0
The Committee To Elect Larry Piegza,0
The Collective PAC; not authorized by any candidate or any candidate's committee.,0
"The Coalition for a Better Illinois 6th (CBIL6), a network of grassroots groups across the 6th Congressional District of Illinois who share a core set of values based on the beliefs that people in the United States deserve equal and fair treatment and that a successful democracy requires an informed and engaged public.",0
The Center for Election Science,0
The Campaign to Elect Jake Ware,0
The Campaign to Elect Adline Clarke,0
"The Alabama Democratic Conference, 424 S. Decatur Street, Montgomery, AL 3604",0
The #News,0
Thad Michael is Senior Benefits,0
"Ten Commandments Amendment PAC, PO Box 1762, Orange Beach AL  36561",0
Tee Shirt Palace,0
Teacher Freedom,0
TaxAct,0
Tammy Baldwin for Senate,0
TZ Insurance Solutions,0
Swing Left. Not authorized by any candidate or candidate's committee.,0
Support The 2nd Amendment,0
Support Shirts R-Us ,0
SupChina,0
Suozzi for Congress,0
Sunday Gover For Assembly 2018,0
Sudan Relief Fund Inc.,0
"Students, Parents and Teachers Supporting Marshall Tuck for Superintendent of Public Instruction 2018, a project of EdVoice. Committee major funding by EdVoice. Not authorized by a candidate or a committee controlled by a candidate.",0
Strasson Group,0
"Stewart for Senate, Inc. ",0
Steven Hayden,0
Steve Guiliotis,0
Steve Allison for Texas House,0
