"Tom Parker for Chief Justice, P.O. Box 11822, Montgomery, Alabama, 36111.",200000
Judicial Crisis Network ,200000
Committee to Elect Christy Edwards to Alabama Court of Civil Appeals,200000
the campaign to re-elect Senator David Burkette,100000
"Ten Commandments Amendment PAC, PO Box 1762, Orange Beach, AL  36561",100000
Jefferson County Metro Area Crime Center ,100000
"Anderson for Alabama, P.O. Box 2337 Montgomery, AL 36102",100000
the Republican Party of Shelby County,50000
Walt Maddox for Governor,50000
"Tim Melson for State Senate P.O. Box 550 Florence, AL",50000
Friend of Arnold Mooney,50000
DoSomething,50000
"Dial for Ag & Industry. PO Box 248 Lineville, AL 36266",50000
"Committee to Elect Charles Elliott, P.O. Box 922, Decatur, AL 35602",50000
"By Friends of Troy King, PO Box 240818, Mongtomery, AL",50000
Congressman Mo Brooks,49842
"Elect Stephen Evans 2932 Ross Clark Circle PMB 339 Dothan, AL 36301",49090
Coalition to Build the Bridge to the Beach,41694
the Committee to Elect Joe Davis,32582
PowerPAC Georgia,18979
People United for Privacy,10548
Center for Consumer Freedom,10427
"the TJ Maloney Campaign P.O. Box 34 Heflin, AL 36264",10000
"the Committee to Elect Spiro | PO Box 1964, Mobile, AL 36633",10000
the Committee to Elect Jackie Anderson-Smith,10000
"the Campaign to Elect Jeff Austin, P.O. Box 3193 Muscle Shoals, AL 35662",10000
the Baldwin County Republican Party,10000
Twinkle for Alabama,10000
Trump Train News,10000
"Tracie West for Alabama School Board 300 North Dean Road Suite 5-123 Auburn, AL 36830",10000
The Monroe County Republican Party,10000
The Committee to Re-elect Judge David Kimberley,10000
The Committee to Elect Jimmy Nunn,10000
"The Committee to Elect Heather Milam, P.O. Box 320882, Birmingham, AL 35232",10000
The Committee to Elect Danny Crawford,10000
The City of Birmingham ,10000
"The Chamber, Gadsden and Etowah County",10000
Siegelman for Attorney General,10000
Ron Johnson for State House,10000
"Rhett Marques for State Representative, 105 Marshwood Place, Enterprise, AL 36330",10000
Randy Steven Dixon Campaign Fund ,10000
Paul Bussman for State Senate,10000
Paid for by the Committee to Re-elect Commissioner George Bowman,10000
"Paid for by the Committee to Elect Brandy Hambright, Circuit Court, PO Box 1901 Mobile, AL 36633",10000
"Paid for by Alabama House Democratic Caucus PO Box 131 Montgomery, AL 36101 ",10000
NumbersUSA,10000
"Mike Hale for Sheriff • PO Box 269 • Trussville, AL 35173",10000
Michael Edmondson ,10000
Marshall County Republican Party,10000
Luther Pate,10000
Lee Auman for United States Congress,10000
Joel Lee Williams for State Representative,10000
Jim Toomey,10000
"James Hedgspeth for Etowah County Probate Judge PO Box 1036, Gadsden, AL 35902",10000
"Humphrey Lee Campaign PO Box 862 Sheffield, AL 35660",10000
HIGHTOWER FOR ALABAMA,10000
Gary Palmer for Congress,10000
"Friends of Will Ainsworth  7520 Browns Valley Rd. Guntersville, AL 35976",10000
Friends of Jay Hovey,10000
"Friends of Frank Barger, P.O. Box 2053, Huntsville, AL 35804",10000
"Friends of David Wheeler, 2532 Crossgate Place, Vestavia Hills, AL 35216",10000
Friends of Danner Kline,10000
"Friends of Andy Whitt, P.O. Box 306, Harvest, AL, 35749",10000
Delivered Digital Marketing,10000
Cullman Today Advertising Dept.,10000
Congresswoman Terri Sewell,10000
"Committee to Elect Will Barfoot, 4280 Wallahatchie Road, Pike Road, AL 36064",10000
"Committee to Elect Steven Curtis, 217 Palos Verdes Drive, Troy, AL 36079",10000
"Committee to Elect Rob Robertson  PO Box 2332, Tuscaloosa, AL 35403",10000
"Committee to Elect Phil Andrews, 2449 Colburn Mountain Rd. Tuscumbia, AL 35674 ",10000
"Committee to Elect Mark Story 1523 Co Rd 230 Selma, AL",10000
"Committee to Elect Joel Hagood  600 Glen Oaks Dr. Jasper, AL 35504",10000
"Committee to Elect Danny Carr - P.O. Box 1961, Birmingham, AL 35203",10000
"Committee to Elect Chad Young 100 Francis Ave. ste A Muscle Shoals, AL 35661",10000
"Clarke White for House Committee 504 Candlewood Dr. Enterprise, AL 36330",10000
Carl Carter for Alabama Senate 11,10000
"Campaign to Elect Nicole Saia 270 Doug Baker Blvd, Suite 700-322 Birmingham, AL 35242",10000
Bell Media,10000
Alliance for a Pro-Life Alabama,10000
Alabama for Healthy Families,10000
Alabama Political Reporter,10000
"Alabama Federation for Children PAC, PO Box 43055, Vestavia, AL 35243",10000
"Adam Parker Campaign 111 Adris Place Dothan, AL 36303",10000
#VOTEPROCHOICE. Not authorized by any candidate or candidate's committee.,10000
"Friends of Kevin Turner, P.O. Box 18606, Huntsville, AL 35804",9998
the committee to elect Jared Millican,9992
"Brett Easterbrook Campaign 633 Escatawpa Rd., Fruitdale, AL 36539",9992
"Winning for Women, Inc.",9991
The Robert McKay Campaign,9991
The Truth about Brandy Hambright,9985
"the Rick Burnham Campaign, P.O. Box 2213, Tuscaloosa, AL 35403",9980
Paid for by official funds authorized by the House of Representatives.,9959
"Tim Ramsey Campaign 399 Canoe Creek Rd, Rainbow City, AL 35906 ",9852
Harry Shiver Campaign,9805
"Kyle South Campaign PO Box 65 Fayette, AL 35555",9803
Committee to Elect Tommy Hanes,9694
Libertarian Party of the Tennessee Valley,9624
Nick Welden For Sheriff,8482
Airbnb,7601
Katie Hill for Congress,7516
"Resurgent Media, LLC",7158
"The campaign to elect Debbie Wood  3011 20th Avenue Valley, Al. 36854",6732
Positive Christian Purity,6449
Joe Walsh,5916
Ben Ferguson Show,5185
the campaign to elect Malika Sanders Fortier,5000
the Committee to Elect Anthony Underwood for Mayor,5000
the Campaign to Re-Elect Senator David Burkette,5000
the Campaign to Elect Jake Ware,5000
Willie Gray for AL House 102,5000
Williams for Senate 34,5000
"Wes Kitchens Campaign 1020 Fry Gap Rd. Arab, AL 35016",5000
Wellspring Advertising for the Client Featured in this Post,5000
Video Visions Media Marketing,5000
Tom Butler for State Senate,5000
Todd Rauch for Alabama,5000
"The committee to elect Judge Wes Allen, PO Box 150, Troy, AL 36081",5000
The Committee to Elect Cory Creel,5000
The Auto Alliance,5000
Take Back Our Republic a C(3) non-profit educational organization ,5000
"Stop the Home Tax PAC, PO Box 2445, Muscle Shoals, AL 35662",5000
"Sherman Guyton Campaign PO Box 1662 Gadsden, AL 35902",5000
Sewell For Congress,5000
Scott Lloyd for Circuit Judge,5000
"Rusty Jessup for State House Campaign  160 Scisson Lane Riverside, AL 35135",5000
Roger Stone,5000
"Robert Byrd for Coroner, 100 Nottoway Blvd. Dothan, AL 36303",5000
Randy Price for Alabama Senate District 13,5000
"Phil Sims Guntersville, Al. 35976",5000
"Parker Griffith 101 Lowe Ave. Suite 3A Huntsville, Al. 35801",5000
"Paid for by the Committee to Elect Spiro | PO Box 1964, Mobile, AL 36633",5000
"Paid for by Friends of Andrew Jones  690 County Road 202 | Centre, AL 35960",5000
"Mike Sparks for Senate P.O. Box 386 Lineville, AL 36266",5000
Mike Rogers for Congress,5000
"Michael Dozier Campaign, P.O. Box 613 Wetumpka, AL 36092",5000
"Melanie Hill for State Board of Education District 2, Treasurer Kelli Pylant, 109 Princeton Drive, Dothan, AL 36301",5000
Mark Shirey Campaign,5000
"Mark Moon for Blount County Sheriff, 200 Greystone Dr. Oneonta, AL 35121",5000
"Madison Co GOP P.O. Box 2301 Huntsville, AL 35804",5000
"Linda Meigs for Alabama House LLC P.O. Box 4181 Huntsville, AL 35815",5000
Laura K. Gregory for Probate Judge,5000
"Jim Williams 4 Senate 12, PO Box 2811, Anniston, AL 36202",5000
Jefferson Country Sheriff's Office,5000
"Jay Mitchell for Alabama Supreme Court P.O. Box 59371 Homewood, AL 35259",5000
James B Chapman for Sheriff Campaign,5000
Indivisible Action,5000
Hal Walker for Auburn City Council Ward 2,5000
"Friends of Will Ainsworth. 7520 Browns Valley Rd, Guntersville, AL 35976",5000
Friends of Ritchie Whorton,5000
"Friends To Elect Parker Duncan Moore, ​P.O. Box 164 Decatur, Alabama 35602",5000
Family Equality Council,5000
"FRIENDS OF MIKE BALL 105 CANTERBURY CIRCLE MADISON, ALABAMA 35758",5000
Ed Oliver,5000
"David Law for Circuit Judge PO Box 217 Rockford, AL 35136",5000
Craig Ford Campaign,5000
"Committee to Elect Will Motlow Probate Judge P.O. Box 569 Florence, AL 35631",5000
Committee to Elect Thomas Thrash ,5000
Committee to Elect Scott Hassell PO Box 2739 Gadsden Al 35903,5000
"Committee to Elect Roger Newman Russell County Coroner, 22 Stillwell Drive, Phenix City, AL 36869",5000
"Committee to Elect Judge Sarah Stewart 2029B Airport Blvd #206 Mobile, AL 36606",5000
Committee to Elect Judge Bob Vance,5000
Committee to Elect Jack Jacobs,5000
"Committee to Elect Greg Reed - 800 Hwy 78 E, Ste 200 #106, Jasper, AL 35501",5000
Committee to Elect Cam Ward,5000
Committee to Elect Brian Plant,5000
Committee to Elect Billie Jo Underwood,5000
Color Of Change,5000
"Campaign to Elect Proncey Robertson, P.O. Box 105, Mt. Hope, AL 35651",5000
Bright for Congress,5000
Ben Robbins for State House,5000
Alabama Arise,5000
45 Hats,5000
 STEVE MARSHALL FOR ALABAMA,5000
"the Baldwin County Democratic Executive Committee, P.O. Box 73, Fairhope, AL 36533",4979
The Committee to Elect Amy Wasyluka for Senate,4957
Progressive Turnout Project,4931
Phil Segraves for House District 17,4893
Media Research Center,4787
"The Tennessee Republican Party, Frank Colvett Jr., Treasurer ",4771
"Mainstream Voters of Washington, Democrat",4740
Eric Fasci,4041
Boeing,3975
Planned Parenthood Federation of America,3823
Batman for Assembly,3793
the Committee to Elect Judge Bill Scully,3555
Law Office of Andrew C. Dodgen,3429
C-SPAN,2800
Purpose,2716
Patagonia ,2707
policetees,2640
"Main Street Law Firm, PLLC",2524
NAACP Legal Defense Fund,2396
Progress News Network,2318
Daily Wire,2274
Teflon Film LLC,1958
NRATV,1947
WeThePeopleHolsters ,1896
Mississippi Development Authority,1845
Personal Liberty,1791
The Explore Offshore Coalition,1790
"Strauss Brands, Inc.",1780
The Humane Society of the United States,1761
FirstQuoteHealth,1715
"Rep GA Institute, Inc.",1623
"Marin Crops, LLC",1588
 Committee to Elect John M. Hoppough,1554
The Term Limit Revolution,1399
Dogwood Alliance,1384
Citizens for Tobacco Rights,1328
Pfizer,1303
Citizen Health,1274
Rachel's Action Network,1215
Charlie Kirk,1207
NRLN,1177
The Committee To Elect Amy Bryan ,1147
Hello Resistance,1113
FreightWaves,1054
State Policy Network,1010
the campaign to re-elect Kelvin J. Lawrence,1000
the campaign to elect Franklin Fortier,1000
the Milken Family Foundation,1000
the Committee to Elect Nancy Carlton Bendinger,1000
the Committee to Elect Lora Kay Morrow,1000
the Committee to Elect JB King,1000
"the Alliance for Alabama’s Infrastructure, 2 North Jackson Street, Montgomery, AL 36104",1000
john taylor campaign 504 chandler st dothan al. 36301,1000
Yellowhammer News,1000
Yellowhammer Fund,1000
Willie Gray for House 102,1000
Will Boyd for Alabama Campaign Committee,1000
"Varner for Council, 854 Oakview Ave., Gadsden, AL 35901",1000
"Valerie Bradford Davis Campaign 244 N. Jackson St. Grove Hill, Al 36451",1000
UAB Collegiate Recovery Community,1000
"Todd Rauch for Alabama, P.O. Box 2403, Opelika, AL 36803",1000
Todd Entrekin,1000
The SOS Survival Fund,1000
"The Party of Reason and Progress, a 527 political organization, through its Facebook-authorized executive staff.",1000
The Mike Holmes Campaign,1000
"The Committee to Elect Ted Sexton, PO Box 1657, Tuscaloosa, AL 35403",1000
The Committee to Elect Matt Fridy,1000
"The Committee to Elect J.B. King/P.O. Box 21173 Huntsville, AL 35813",1000
The Committee to Elect Hanu Karlapalem for Limestone County Commissioner District 3,1000
"The Committee to Elect Emily Page Steele Monroe County District Judge 3 W. Claiborne St. Monroeville, AL 36460",1000
The Committee to Elect Debra Weston-Pickens,1000
The Committee To Elect Quartez Dan Harris Diistrict 4 City Councilman,1000
"The Committee To Elect Al Booth 512 Wetumpka Street Prattville, AL 36067",1000
The Alabama Policy Institute,1000
Terri Collins for House District 8,1000
Tennessee Riverkeeper,1000
"THE COMMITTEE TO ELECT WILSON HALE SHERIFF P.O. BOX 10925 BIRMINGHAM, AL 35202",1000
"Summer Padgett Campaign PO Box 777 Jackson, AL 36545",1000
Stutts for Senate,1000
Spiro Cheriogotis,1000
Shannon Moore,1000
Shane Stringer Campaign ,1000
"Scott Stadthagen Campaign P.O. Box 1512 Hartselle, Alabama 35640",1000
Satterwhite for Judge,1000
Ryan for Auburn Ward 4 Committee,1000
"Ryan Renaud for School Board District 4 500 Vance Dr. Huntsville Alabama, 35801",1000
Rosemary Schexnayder,1000
Rocket City Young Democrats,1000
"Robinson For Judge PO Box 1026 Gadsden, AL 35902",1000
Resolute News,1000
Republicans for the Rule of Law,1000
Renew Alabama,1000
"Re-Elect Jeff Overstreet Etowah County Commission District 4 101 Roseland Drive Rainbow City, AL 35906",1000
Political Advertisement by Thomas Rodgers P. O. Box 141 Sweet Water Al. 36782,1000
Phillip Pettus for Alabama House District 1,1000
Peter Joffrion for Congress,1000
Persistance PAC,1000
"Parker Griffith 101 Lowe Ave. Suite 3A Huntsville, AL 35801",1000
Parker Campaign,1000
Oravet Media LLC,1000
NeSmith Immigration Attorneys,1000
National Solar Rebate,1000
National Loan Programs,1000
Mobile Chapter of The University of Alabama National Alumni Association,1000
Mike Williams for Probate Judge,1000
Mike Hale for Sheriff ,1000
"Mike Anderton for District Attorney - Birmingham, AL ",1000
MedicareBob,1000
"Medical Advocacy & Outreach (MAO). Questions? Contact Thomas Stephens, MAO Media Relations.",1000
"McKenzie Healthcare Advocacy, LLC",1000
Mary Jane Caylor for City Council,1000
"Mark Yarbrough Campaign P. O. Box 1413 Athens, AL 35612",1000
Mark Marshall,1000
Mallory Hagan for Congress,1000
"Lister Reeves for State Representative 200 Savannah Drive Enterprise, AL 36330",1000
"Limestone Country Republican Executive Committee. 112 W. Market Street, Athens, AL 35611",1000
"Les Tillery for City Council District 2 P.O. Box 18162 Huntsville, AL 35804",1000
Lauderdale County Democratic Party,1000
Kelley Griswold,1000
Kari Powell for PSC,1000
Johnny Mack Morrow for State Senate,1000
Johnny Mack Morrow Senate Campaign,1000
"John Shearon, 810 Wilson Road, Clanton, AL 35045",1000
"Joe Knight Campaign • 3124 Trace Way • Trussville, AL 35173",1000
Joanne Whetstone for House District 90 ,1000
"Jim McClendon for Senate 361 Jones Road Springville, AL 35146",1000
Jim Bonner for PSC,1000
"Jefferson County Republican Committee • P.O. Box 590101 • Birmingham, AL 35259",1000
"Jefferson County Democratic Party, Box 10522, Birmingham 35202",1000
Jefferson County Commission,1000
Jeff Poor,1000
Isbell For House 28,1000
Hoover Forward,1000
"Gene Smith, Hoover City Council President",1000
"Garlan Gudger for State Senate 314 2nd Ave SE, Cullman, AL 35055",1000
Friends to Elect Silas Isaiah Baldwin for Bessemer City Council District 7,1000
"Friends to Elect Rex Reynolds P.O. Box 18743, Huntsville, AL 35804",1000
Friends to Elect David Faulkner,1000
Friends of the Shoupe Monument,1000
Friends of Wayne Johnson,1000
Friends of Tabitha Isner,1000
"Friends of Rich Wingo 1105 Southview Lane Box 224 Tuscaloosa, AL 35405",1000
"Friends of Phillip Pettus, 771 County Road 144, Killen, AL 35645",1000
"Friends of Nicki Arnold-Swindle, PO Box 1733 Anniston, Alabama 36202",1000
"Friends of Lee Hamilton, P.O. Box 68, Dadeville, AL 36853.",1000
Friends of Jeff Williams,1000
"Friends of Jason Wilson Political Campaign Fund Gadsden, AL 35901",1000
"Friends of Howard Sanderford, 908 Tannahill Drive, Huntsville, AL 35802",1000
Friends of Felicia Stewart,1000
Friends of Dimitri Polizos,1000
Friends of Brett Smith,1000
Friends of Arnold Mooney,1000
"Friends of Allen Farley, P.O. Box 516, McCalla, AL 35111",1000
Friends for Brian O'Neil,1000
Friends To Elect Lashunda Scales For Jefferson Commission 1,1000
Freedom Trade International,1000
Flip Texas - 32,1000
Elect Pamela Howard - Alabama House Dist 40,1000
"Elect Danielle Mashburn-Myrick  P.O. Box 821 Fairhope, AL  36533",1000
Eddie Burke 18230 Co Rd 29 Weogufka AL 35183,1000
"East for Probate Judge, PO Box 83, Daviston, AL 36256",1000
"Democratic Victory Fund, PO Box 407, Montgomery AL 36101",1000
"David Young for Coroner. 134 Townsend Road Hazel Green, AL 35750",1000
David Jones for Superintendent PO Box 51 Arab AL 35016,1000
David Hill Committee,1000
"Danny Shears, 2108 Marian Lane, Oxford, AL 36203",1000
"DONNA BEAULIEU FOR CRIMINAL APPEALS JUDGE. P.O. BOX 357 SAGINAW , AL 35137",1000
Cunningham for Judge,1000
"Craig Lipscomb 30, PO Box 1536, Gadsden, AL 35902",1000
Conservatives for Better Leadership.,1000
"Committee to elect George Zoghby, P.O. Box 817-0817, Mobile, AL 36601",1000
Committee to Elect Patrick Kennedy,1000
"Committee to Elect Neil Rafferty P.O. Box 321579 Birmingham, Alabama 35232",1000
"Committee to Elect Mike Segrest, P.O. Box 780791, Tallassee, AL 36078",1000
Committee to Elect Matt Simpson,1000
"Committee to Elect Kyle Pierce, PO Box 787, Attalla, AL 35954",1000
"Committee to Elect Kristy Kirkland, PO Box 2063,  Dothan, AL 36302",1000
"Committee to Elect Jessica Fortune Barker for State Board of Education, District 8",1000
Committee to Elect Elijah Boyd,1000
Committee to Elect Eddie Britton,1000
Committee to Elect Donna Smalley for Alabama Supreme Court ,1000
Committee to Elect Chris Robinson,1000
Committee to Elect Cara McClure  ,1000
"Committee to Elect C. Terry Jones, P.O. Box 228 Meridianville, AL 35759",1000
Committee to Elect Bill Roberts to Alabama State Senate,1000
"Committee to Elect Alaric May - 310 Richard Arrington Jr. Blvd, Birmingham, AL 35203",1000
Coastal PAC,1000
Clete Wetli,1000
"Chris McCool for Criminal Appeals PO Box 281 Reform, AL 35481",1000
Chess Bedsole for Attorney General,1000
Charles Talbert Campaign,1000
"Caroline Self for Senate, PO Box 714, Florence, AL 35631",1000
Campaign to Elect Proncey Robertson,1000
Campaign to Elect Judge Kechia Davis ,1000
Campaign To Vote Mike Cole For Sheriff Of Walker County 2018,1000
COMMITTEE TO ELECT ELIZABETH HANEY ,1000
CItizens to Elect Mirarchi,1000
CAMPAIGN TO ELECT MITCHELL JAMES,1000
"Butler Co GOP, 112 Stoneroad Drive, Greenville, AL 36067",1000
"Brad Mendheim for Supreme Court PO Box 10203 Dothan, Alabama 36304",1000
Bob Parsons ,1000
BlackPAC and not authorized by any candidate or candidate’s committee.,1000
Andrew Hairston for Circuit Judge,1000
Americans For Prosperity,1000
"Alliance for Alabama’s Infrastructure, 2 North Jackson Street, Montgomery, AL 36104",1000
"Alabama for Healthy Families, P.O Box 4476, Montgomery, AL 36103. Not authorized by any candidate or candidates committee.",1000
Alabama Today.,1000
Adam Jortner for Alabama Board of Education,1000
AIDS Alabama,1000
AG Crowe for Secretary of State,1000
ACLU of Alabama,1000
 Middleton Consulting Firm LLC,1000
the Mobile County Republican Executive Committee.,999
"Maggie's List, a Political Action Committee",999
"Easley For AL House 104 Campaign, PO Box 9591, Mobile AL 36691 (251)273-4178",999
Chris Christie for Alabama AG PO Box 59141 Birmingham AL 35259,999
Beth Chapman,999
John Baker Sheriff DeKalb County,998
Hulu,998
Francis Paul Ripp,998
"Melvin Hasting for Circuit Judge, 1400 County Road 1422, Cullman, AL 35055",997
Jeremy Oden for Public Service Commissioner,995
Madison County Democratic Women,989
"James Dolan for Alabama House District 1 110B Tuscaloosa St. Florence, AL 35630 ",977
Committee to Elect Kyle Brown,962
Rich Shumate,961
Friends of Tucker Dorsey,961
 Allied Progress Action,920
Marcie Foster- Cherokee County Commissioner District #3,919
FWD.us Education Fund,912
Keep and Bear,882
Concerned Veterans for America,880
Conservatives Against Media Manipulation,846
Nuclear Energy Institute,836
Avi Bernard,836
"Guardians of Old Daphne neighborhood group in downtown Daphne, Alabama",821
Ben & Jerry's,816
"American Center for Law and Justice, a d/b/a for Christian Advocates Serving Evangelism, Inc.",813
Donald J. Trump - online store for Trump/Pence merchandise and campaign collectibles.,809
RNY Initiative,804
Black Voters Matter Fund,762
"BRANDON NEWSOM REP, FOR HOLMES COUNTY COMMISSIONER DIST 2",760
Jesus Nebot,750
Hill Reporter,749
Chris Gulley 119 Olcott Ave Bridgeport AL 35740,739
Redneck Nation,731
Eddie  Britton for State House Campaign ,730
Cory Booker for Senate ,716
"Amiri King, Inc",687
"Committee To Elect Charlotte Clark-Frieson, Alabama House Of Representatives House District 37",619
Tennessee Republican Assembly,607
House Republican Organization of Illinois,585
Transamerica Center for Health Studies,569
Save Animals Facing Extinction,563
Demand Justice,513
the Physicians Committee for Responsible Medicine,492
Cameron Smith,485
Diversity Incorporated ,447
New Hampshire Leadership Committee,441
NRDC Action Fund,429
"Public Land, Public Benefit, No on E, Yes on G, a coalition of San Diego taxpayers, community planners, local business, and education, park and environmental advocates. Committee major funding from H.G. Fenton Company and Sudberry Properties.",419
Priorities USA Action and SMP. Not authorized by any candidate or candidate's committee.,402
Created Equal,401
the Republican Party of Florida.  Not authorized by any candidate or candidate's committee.,391
Painter Minnesota,390
In Search of Liberty,376
Cargill,376
Defend US PAC,373
"the Committee to Elect Chris Blackshear 57 Stonedale Court Smiths Station, AL 36877",364
100 Percent Deplorables,360
MJ for Texas,358
Michigan Leadership Committee. Not authorized by any candidate.,356
Federal Voting Assistance Program,351
"The Christian Broadcasting Network, Inc.",350
John Catsimatidis,350
The LIBRE Initiative,349
Randy Boyd for Governor,346
Gillibrand for Senate,344
ExxonMobil,343
EMILY's List,342
Webinar Technologies,339
Institute for Southern Studies,339
Summer T-Shirts,337
"Freedom Watch, Inc.",334
USPS,325
Linda Sanborn for School Board District 1,324
Oxfam America,320
Sinclair Broadcast Group,319
Naturally Fit Inc,309
Donny Moss,299
"Benepath, Inc.",298
Skyline Ridge Press,295
Welcome.us,292
Great America Alliance,285
2atees1,283
St. Martin's Press,282
Lake Ray for Tax Collector,279
Paid for by Howard Sherman for Senate,274
National Pediatric Cancer Foundation,272
Yale Climate Connections,271
Scott Wagner For Governor,271
"DC Doris for Congress Committee Vicky Ganacias Borja, Treasurer P.O. Box 3060, Hagåtña, Guam 96932",271
American Center for Law and Justice,268
America First Policies,268
Middle East Forum,266
Paramount Network,265
True Conservative,256
National Education Association,254
Proud American Hunter,252
Everytown for Gun Safety Action Fund,250
Mark Green for Congress.,244
China-US Focus,243
Charlie Bailey for Georgia,243
The New MAGA,240
You Know Who You Are,238
TheBlaze,233
"ClearPath Action, Inc. Not authorized by any candidate or candidate's committee.",233
Kenny Long for Santa Rosa County School Board District 3,232
theSkimm,226
U.S. Term Limits,226
JD Smith,225
Captains for Clean Water,220
The American Gun Association ,219
Union of Concerned Scientists,218
Convention of States Action,218
American Engagement Technologies,218
NRA Women,217
Conservative Tribune,215
All4TheCause llc,213
Abortion On Our Own Terms,212
 Penguin Young Readers,211
Americans for Farmers and Families,210
Shatterproof,208
National Institute of Firearms,208
Beyond the Choir,208
Portfolio Books,206
Colorado Information Network ,205
Brandon Peters for U.S. Congress,205
Sunrise Outlet,203
Conservative Gear,201
National Committee for a Human Life Amendment,199
Catalyst,194
the Voter Participation Center,193
The Whiskey Patriots,193
Cold Dead hands of America,193
The Charlie Daniels Band,192
Sandy Hook Promise,192
T-Mobile,191
Stand Up North Florida,190
"Public Land, Public Benefit, No on Measure E, a coalition of San Diego taxpayers, community planners, local business, and education, park and environmental advocates, opposed to SoccerCity. Supported by Mission Valley property owners. Committee major funding from H.G. Fenton Company and Sudberry Properties.",190
Donald J. Trump - online store for campaign gear,190
Alliance for Patient Access,190
Jack Miller Down to Business,189
Military Tees,186
Squirrel Helmets,185
EFB Advocacy,184
The Years Project,180
"Fiorella Insurance Agency, Inc.",177
PoliticusUSA LLC,176
Celebrity Voice Changer,176
AGV MEDIA,176
People Over Politics,175
Concerned Citizen,174
Human Coalition,173
The Ohio State University Alumni Association ,168
Secure America Now,166
National Women's Health Network ,163
Committee to Elect Kelly Mims,163
getVokl,160
"ASMDSS, Inc",160
American Academy of Family Physicians ,159
FreedomWorks,158
Bill O'Reilly Staff,158
"End Party Politics, LLC",156
Right Wing News ,155
The Democratic Coalition,153
Tom Del Otero (Kasie's Dad),152
Homes For Our Troops ,152
STARZ Shows,151
Alan McMillan for Escambia County Commissioner - District 2,150
DrugJustice,149
My Shop Therapy,148
2A4LIFE LLC,148
KWTV News 9,147
"Friends of Maggie Toulouse Oliver, Robert Lara Treasurer",147
Committee to Elect Evan Ross,147
the Holland Children's Movement,146
Human Rights Campaign,146
Schuring for Ohio,145
California Justice & Public Safety PAC,145
The Brookings Institution,143
the International Campaign for Tibet,142
Teach For America,141
Senior Lifestlye Improvement Inititive ,141
Restoration PAC,141
John McCann for Congress.,140
Southern Poverty Law Center,139
Oral Health America,138
Wind Energy Foundation,136
Cheddar,135
 LeftAction,135
The Years Project Action Fund,131
Super LTD,131
