the Tea Party Nation and is not authorized by any candidate or candidate's committee.,500000
RATE Coalition,500000
The North Carolina Homeowners Alliance,200000
The Auto Alliance,200000
Rep. George Holding,200000
New American Jobs Fund and not authorized by any candidate or candidate’s committee.,200000
Rachel's Action Network,100000
NC Common Ground,100000
Earls for Justice Committee.,100000
The Committee to Elect Michael Lee,50000
Resolute Free Press,50000
North Carolina Republican Council of State Committee,50000
North Carolina Democratic Party. Not authorized by any candidate or candidate's committee.,50000
Majority Matters,50000
Higher Education Works,50000
Small Business & Entrepreneurship Council,49956
McHenry for Congress,49895
Mark Harris for Congress,49863
Committee to Elect Glenn Perry District Attorney,47355
Committee to Elect Justin N. Davis,45710
American Lung Association,21369
NRATV,18603
Joe Walsh,18039
STAND FLAG POLES,15354
Union of Concerned Scientists,12557
Webinar Technologies,11886
MedicareBob,11393
the North Carolina Democratic Party and Gayle Kemp for State House.,10000
the North Carolina Conservation Network,10000
the Harry Ennis for Sheriff Campaign,10000
the Committee to Re-Elect Allison Gant,10000
the Committee to Elect Caroline Walker ,10000
the Andy Hanford for Superior Court Judge Campaign ,10000
Wilson County Republican Party,10000
Ulmer for NC,10000
UNC-Chapel Hill,10000
Tony Keech for Sheriff,10000
Toby Hampson for Judge,10000
The Nature Conservancy,10000
The Committee to Elect Jarrod Lowery,10000
The Committee to Elect Brooke Schmidly,10000
The Committee to Elect Brian Bock,10000
The Committee To Re-Elect Judge Alicia D. Brooks,10000
The Committee To Elect Wayne Coats Sheriff,10000
Stanly County Democratic Party,10000
Show Up To Vote,10000
Scott for District Attorney,10000
Reject Racism,10000
Ray McKinnon or his Committee,10000
Progressive Turnout Project,10000
Progressive Takeover and not authorized by any candidate or candidate's committee.,10000
Progress North Carolina Action,10000
Progress NC Action,10000
Planned Parenthood Action PAC North Carolina. Not authorized or in coordination with any campaign.,10000
Partners,10000
North Carolina Republican Party. Not authorized by any candidate or candidate’s committee.,10000
North Carolina Democratic Party,10000
North Carolina Association of Educators,10000
News For Democracy,10000
NC Senate Majority Fund,10000
NC Family Policy Council,10000
NC Conservation Network,10000
McCready for Congress,10000
"Marsy’s Law for North Carolina, L.L.C.",10000
Marsy’s Law for North Carolina LLC,10000
Lofton for NC,10000
Kyle Hall Committee,10000
Keep Jim O’Neill District Attorney,10000
Kathy Manning for Congress,10000
John Bell Committee,10000
Higher Heights for America,10000
Garrett for NC,10000
Garrett For NC ,10000
Friends of Tim Moore,10000
Friend of Emmanuel Wilder,10000
FREEAMERICA,10000
Ernie Coleman for Sheriff,10000
Elmore for NC House ,10000
Doctors Without Borders/Médecins Sans Frontières (MSF),10000
"Darrell B. Cayton, Jr. for Judge",10000
Concealed Online,10000
Committee to elect Neill Lindley,10000
Committee to Elect Harper Peterson ,10000
Committee To Elect Aimy Steele for House District 82,10000
Columbus Jobs Foundation,10000
Color Of Change,10000
Citizens to Elect Lexanne Huffman,10000
Citizens for JD Wooten,10000
Checks and Balances Project,10000
Chad Stachowicz for NC,10000
"Carolina Leadership Coalition, Inc. Not Authorized by Any Candidate.",10000
Captains for Clean Water,10000
Campaign to Elect Donna Ensley ,10000
Bruce Berry for Commissioner Committee,10000
Blue Cross NC,10000
"America First Action, Inc. Not authorized by any candidate or candidate's committee.",10000
Amanda for NC House,10000
Alliance for Climate Education,10000
Future in America,9998
the committee to elect Rhonda Allen,9997
DD Adams for Congress,9997
Advance Carolina,9993
Federation of American Hospitals,9989
Chad Brown For Gaston County Commissioner,9980
"Vote Yes for a Stronger, Healthier Scotland",9962
Mack Paul for NC Senate,9746
Girls in Politics Initiative ,9568
 Committee to Elect Chris Fann Clerk of Court,9480
Citizens for Gregory B. Thompson,9289
the office of Congressman David Rouzer,9275
Spectrum News,9175
Blumenthal Performing Arts,9110
Sauls for NC House,8805
the Gaston County Republican Party. ,8272
Dissent Pins,7534
DrugJustice,7455
Paramount Network,7098
WKRK Radio,6926
American Possibilities PAC,6640
the National Democratic Training Committee,6418
Students for Life of America,6352
Ted Cruz for Senate,6315
Parks Project,6017
2A4LIFELLC,5969
Everytown for Gun Safety Action Fund,5815
"Vasquez Law Firm, PLLLC",5319
Greenpeace USA,5170
the North Carolina Democratic Party and Love for NC.,5000
the Committee to Elect Amy Galey,5000
by Progress North Carolina,5000
Wiley Nickel for North Carolina,5000
"Wildlands Network, a 501c3 conservation nonprofit organization",5000
Wheeler for NC,5000
Wake County Republican Party,5000
Voto Latino,5000
Von Loor for U.S. Congress,5000
Tracy Philbeck for County Commissioner,5000
The committee to elect Wendy Sellars,5000
The Committee to Elect Darrin Gamradt,5000
The Committee To Elect Jeff Tarte,5000
Stop Deceptive Amendments,5000
Roxie Cash for Wake,5000
Riddell for NC House 64,5000
"Rice Law, PLLC",5000
Red 4 Ed NC,5000
Protect Our Care,5000
Paid for by the Sampson County Republican Executive Committee.  Contributions to the Sampson County Republican Executive Committee are not deductible as charitable contributions for federal income tax purposes. All contributions are subject to the limits and prohibitions of the rules set forth by the North Carolina State Board of Elections. State law require,5000
Paid for by the Committee to Elect Judge Louis Trosch,5000
NumbersUSA,5000
North Carolina Values Coalition,5000
North Carolina Justice Center,5000
North Carolina Chamber,5000
NextGen Climate Action Committee,5000
National Solar Rebate,5000
NC Sound Economy,5000
MomsRising Together,5000
McKissick for NC Senate,5000
Matthew Block,5000
March For Our Lives,5000
Libertarian Party of Eastern North Carolina,5000
John David Jackson for Sheriff ,5000
Joe John NC House 40 Committee,5000
Hudson for Congress,5000
"Friends of the Earth (Action), Inc.",5000
Friends of Rick Trevena,5000
Fair Courts Now,5000
Eric Henderson Committee,5000
Environment North Carolina Research and Policy Center.,5000
Elmer Floyd,5000
Elect Paul Ross,5000
Elect Lawrence Fennell for Sheriff Campaign ,5000
Elect Amanda Edwards,5000
EDFAction,5000
Down Home North Carolina,5000
Conservatives for Clean Energy,5000
Congressional Leadership Fund,5000
Committee to Re-Elect Judge April Wood,5000
Committee to Keep Judge Thompson SCJ,5000
Committee to Elect Rebecca Edwards,5000
Committee to Elect Paula Dance for Sheriff,5000
Committee to Elect Kevin Dodson,5000
Committee to Elect Frank McNeill,5000
Committee To Elect Tommy Sofield Watauga County Commissioner,5000
Committee To Elect Michael Garrett,5000
Committee To Elect George Bell For Judge,5000
City of Winston-Salem,5000
Bryant for Wake County DA,5000
BallotReady,5000
Americans for Prosperity,5000
American Bridge 21st Century Foundation,5000
America Fighting Back PAC,5000
AARP North Carolina,5000
Retirement Elevated,4999
Adams For Sheriff,4999
"DCCC. 430 South Capitol St, SE Washington, DC 20003. Not authorized by any candidate or candidate's committee. ",4998
Aim Higher Now,4997
The Committee To Elect Angelica Chavis McIntyre,4996
The Faith and Freedom Coalition,4993
the Dare Democratic Party. Not authorized by any candidate.,4992
House Majority PAC and Priorities USA Action. Not authorized by any candidate or candidate's committee.,4990
Homes For Our Troops ,4987
Human Coalition,4941
NC We the People,4940
Good Jobs Nation,4920
Brand New Films LLC,4913
Committee to Elect D. Cole Phelps,4882
EDF Action,4855
Americans For Prosperity,4646
American Steel Kings,4638
Chaz Beasley for North Carolina,4620
Robert Kellogg for NC House,4597
Joann,4333
"American Center for Law and Justice, a d/b/a for Christian Advocates Serving Evangelism, Inc.",4272
the NRCC and not authorized by any candidate or candidate's committee. www.nrcc.org,4194
Movement Advancement Project.,4023
Happy Hippo LLC,4014
Charlie Kirk,3985
"Public Land, Public Benefit, a coalition of San Diego taxpayers, community planners, local business, and education, park and environmental advocates, opposed to SoccerCity. Supported by Mission Valley property owners. Committee major funding from H.G. Fenton Company and Sudberry Properties.",3951
New York State United Teachers,3837
Rick Scott for Florida,3800
Penzeys,3775
PragerU ,3644
Student Loans News for Certified Enrollment Center,3382
Catalyst,3324
Loud & Proud,3181
Defending Donald,3128
Human Rights Campaign,3127
Daily Wire,3103
Scott Taylor for US Congress,3096
Main Street Investors Coalition,3041
Institute for Southern Studies,3016
Earth,3005
The Explore Offshore Coalition,2938
PAID FOR BY TEMPLETON FOR GOVERNOR,2933
Independent Women's Voice,2917
"iVote Fund, Ellen Kurz, President. Not authorized by any candidate or candidate’s campaign committee.",2893
Save Animals Facing Extinction,2855
FCTRY,2847
Link TV ,2709
Clarion Project,2682
Sony Pictures Classics,2645
The Wilderness Society,2593
Christian Care Ministry,2573
The Alliance for Solar Choice,2550
Pacific Legal Foundation,2523
Salazar for State Senate,2462
"Marin Crops, LLC",2426
the EnergySure Coalition,2306
"Paid For By Swalwell For Congress - P.O. Box 2847 Dublin, CA 94568",2276
Logically Illiberal,2273
Audrey Hudson,2267
White Research & Development LLC,2229
"Mobile Conservative, LLC",2199
Laura Miller,2199
Chad Benson,2199
A Clean Wilson Creek 501c(3) NonProfit Organization,2190
Jack Burkman,2028
PhRMA,1959
BuzzVote LLC,1920
Tim D'Annunzio,1879
YouGov,1831
JIM NEWBERGER FOR UNITED STATES SENATE,1788
The Meanest Woman Alive LLC,1754
Financial Security Today,1690
The Everglades Foundation,1679
Personal Liberty,1670
National Audubon Society,1632
American Patriot Daily News Network LLC,1598
Liberty Watch Magazine,1582
Axios Partner,1565
Liberty Nation,1555
When Democrats Turn Out PAC,1540
Garden State Initiative,1370
CHC BOLD PAC,1351
Real Justice PAC and not authorized by any candidate or candidate's committee.,1342
Crisp and Associates Military Law,1330
American Bridge 21st Century PAC.,1323
Joshua Putnam for Secretary of State,1298
T-Mobile,1246
jorgea hernando,1229
Trauner for the People of Wyoming,1185
The Fight PAC,1115
The Wind Energy Foundation,1091
West Virginia Republican Party.  Not authorized by any candidate or candidate's committee.,1060
Californians for Consumer Privacy. Committee major funding by  Alastair Mactaggart.,1026
California Democratic Party,1006
the Phil Berger Committee,1000
the Office of Congressman Ted Budd,1000
the North Carolina Democratic Party. Authorized by Linda Bennett for NC House 26,1000
the North Carolina Democratic Party. Authorized by Bobbie Richardson for NC House,1000
the North Carolina Democratic Party. Authorized by Barbara S. Yates-Lockamy NC House,1000
the North Carolina Democratic Party and Tim Barnsback for NC House.,1000
the North Carolina Democratic Party and The Committee to Elect Joe Fowler.,1000
the North Carolina Democratic Party and Robert Kellogg for NC House.,1000
the North Carolina Democratic Party and Ric Vandett for NC Senate.,1000
the North Carolina Democratic Party and Mark Shelley for Senate Committee.,1000
the North Carolina Democratic Party and Jennifer Benson for NC House.,1000
the North Carolina Democratic Party and Jen Mangrum for NC.,1000
the North Carolina Democratic Party and Don Davis for NC Senate.,1000
the North Carolina Democratic Party and Committee to Elect Vernon Moore NC State Senate District 10.,1000
the North Carolina Democratic Party and Committee to Elect Terri LeGrand.,1000
the North Carolina Democratic Party and Committee to Elect D. Cole Phelps to NC Senate District One.,1000
the North Carolina Democratic Party and Chad Stachowicz for NC.,1000
"the International Union, United Automobile, Aerospace, and Agricultural Implement Workers of America (UAW).  Not authorized by any candidate.",1000
the Frank Williams Committee,1000
the Committee to Re-elect Mary Wells for Nash County Commissioner.,1000
the Committee to Elect Sarah Neely Lanier Judge,1000
the Committee to Elect Sammy McNeill to Moore County Board of Education,1000
the Committee to Elect Meredith Edwards,1000
the Committee to Elect Jennifer Alexander,1000
the Committee to Elect Ian McMillan,1000
the Committee to Elect Allen Edwards,1000
the Brian Ratledge Committee,1000
linda bauknight,1000
by the committee to re-elect Kristina Earwood,1000
Women Impacting America,1000
Wesley Meredith for Senate,1000
Watts for Congress,1000
Vote Phil Howell For Sheriff,1000
Vote John Czajkowski,1000
Virginia Foxx for Congress,1000
"U.S. citizen Brian Kasher, not by any corporation, political action committee, political party or candidate. Truth2Power 4U is produced for people who want to make change in their own corner of the world. Truth2Power 4U does not endorse political candidates, take positions on legislation, or lobby. We promote participatory citizenship on social media.",1000
Tom Steyer,1000
Together for Mint Hill,1000
Tim Ivey for County Commissioner,1000
Tim Harris for Senate District 2,1000
Thomas Hill 4 Cabarrus,1000
The Progressive Democrats of Orange County NC,1000
The Moore County Republican Men's Club,1000
The Lee County Democratic Party,1000
The Durham Republican Party,1000
The Committee to Elect Richard Allsbrook ,1000
The Committee to Elect Kim Goings Thomas,1000
The Committee to Elect Karen D. McCallum for District Court Judge,1000
The Committee to Elect John Check   Brad Bobbitt Treasurer,1000
The Committee to Elect Jim Hill,1000
The Committee to Elect Elliott Lynch NC House,1000
The Committee to Elect Dennis Litalien,1000
The Committee to Elect David Wilson Brown,1000
The Committee to Elect Dave Hall,1000
The Committee to Elect Claiborne Holtzman,1000
The Committee to Elect Bob Williams,1000
The Committee to Elect Allan Adams,1000
The Committee To Elect Caprice Pratt,1000
The Comedy Zone,1000
The Caitlin Evans Campaign,1000
Ted Budd for Congress,1000
"T@W Films I, LLC",1000
"T. Lee Horne, III. I am T. Lee Horne, III and I approve this ad.",1000
T Love Inc,1000
Swansboro Sea Scouts,1000
"Susan Jane Hogarth, acting as Chair of the LPNC",1000
Steve Grossman for Judge Committee,1000
Stephen Brown,1000
Steele Creek Democrats,1000
State Innovation Exchange (SiX),1000
Stanley Charles Kimer,1000
Southeastern Wind Coalition,1000
Sherry-Lynn Dodson Womack,1000
"Sherri Allgood for Mayor of Troy, NC Committee",1000
Secure Democracy,1000
Sarah Homes Candidate Committee,1000
Sam Edney for NC House Committee,1000
Ron Wesson for NC House,1000
Roger Allison For Congress,1000
Rick Foulke for NC House,1000
Republican Museum of North Carolina,1000
Relevant Seminars,1000
Regina M. Joe,1000
Rebecca Nussbaum and Marilynn Baker for School Board,1000
"Reality Bites Org, North Caorlina",1000
Ray Russell for NC,1000
Randy Walker For Commissioner,1000
Quentin Miller for Sheriff ,1000
Protect Our Workers Earned Retirement,1000
Price 4 WNC,1000
Pittman For Pitt County,1000
Pitt County Democratic Party,1000
Petera For Dare County Commissioner At Large,1000
"Person Count GOP, not endorsed by any candidate or candidate committee",1000
Pam Sutton for Lee County Board of Education,1000
Paid for By Sandra Ray for NC Court of Appeals,1000
Paid For by Malone For House,1000
Orange County Partnership to End Homelessness,1000
Nuts & Dolts,1000
North Carolinians for a Fair Economy,1000
North Carolina Values Coalition PAC,1000
North Carolina Clean Energy,1000
NC Sierra Club,1000
NC AIDS Action Network,1000
Morrison for Commissioner,1000
Michelle O'Shell,1000
Media in the Public Interest,1000
Mecklenburg Evening Republican Women's Club,1000
Mau for Commissioner,1000
Martha Shafer for NC,1000
Mark H Creech,1000
Mario Perez for District Court Judge,1000
MAGA Carolinas PAC,1000
Louis Cosentine,1000
Linda Devore for House 44 Committee,1000
Libertarian Party of Wake County,1000
Libertarian Party of Mecklenburg County,1000
LeadJig,1000
Lauren Faber Comedy,1000
Larry C. Strickland Campaign Committee ,1000
Larry C. Strickland Campaign Committee,1000
LAB15FILM,1000
Kimbrough for Sheriff,1000
Kim Bost for NC House,1000
Kevin T. Raper For Wilson County Sheriff,1000
Joyce Krawiec for NC Senate,1000
Jon Hardister for NC House,1000
Johnston County Republican Party,1000
John David Jackson for Sheriff,1000
Jim Martin 4 Schools,1000
Jerry Boykin,1000
Jeff Matemu for Congress,1000
Jeff Matemu For Congress,1000
Jeff Jackson for NC Senate,1000
INDY Week,1000
I Heart Pisgah,1000
Horner for NC Senate,1000
Hominies Democrats of Buncombe County Democratic Party,1000
Holding for Congress,1000
Heritage Action for America and not authorized by any candidate or candidate’s committee,1000
Heath for North Carolina,1000
H.R.ORR for Craven County Board of Education Campaign Committee  ,1000
Guilford County Republican Party,1000
Glenda P. Weinert for County Commission,1000
GEORGE BOYKIN ,1000
Friends of Sam Searcy,1000
Friends of Natasha Marcus,1000
Friends of Logan Martin,1000
Friends of Laci LeBlanc,1000
Friends of Justin Conrad,1000
Friends of Joe Sam Queen,1000
Friends of George Cleveland ,1000
Friends for Sydney Batch,1000
Freeman for District Attorney,1000
"Freedom House, Greensboro NC, a 501(c)3 organization",1000
Frank Jones for Superior Court Judge,1000
Forsyth County North Carolina,1000
Forsyth County Democratic Party,1000
Fontenot for House,1000
Environmental Defense Fund,1000
Energy Consumers of the Carolinas,1000
Elect Lawrence Fennell For Sheriff Campaign,1000
Elect Kidwell Committee,1000
Elect John Johnson,1000
Elect Jeff Scott Congressman NC09,1000
Edward henderson,1000
Duplin County Democratic Party,1000
Don Davis for NC Senate.,1000
Debbie Hill Campaign,1000
Davis for NC House,1000
Davis for Durham Committee,1000
David Lewis for NC House,1000
David C. Brinkley for NC House,1000
Dan Kowal,1000
DAVID ROUZER FOR CONGRESS,1000
Cumberland County GOP,1000
Crowson for Judge,1000
Cooper for North Carolina,1000
Concerned Veterans for America,1000
Concerned Citizens of Wake County,1000
Concealed Club,1000
Common Cause North Carolina,1000
Committee to re-elect Judge Mary Covington,1000
Committee to elect Greg Ford,1000
Committee to Re-Elect Sheriff Schatzman ,1000
Committee to Elect Vickie Adamson,1000
Committee to Elect Tom Bailey,1000
Committee to Elect Terri LeGrand,1000
Committee to Elect Susan Evans,1000
Committee to Elect Michael G. Knox,1000
Committee to Elect Lisa Mathis,1000
Committee to Elect Kim Coley,1000
Committee to Elect Julie von Haefen,1000
"Committee to Elect Judge Donald Cureton, Jr.",1000
Committee to Elect Josephine Kerr Davis,1000
Committee to Elect John Motsinger Jr,1000
Committee to Elect Gavin Reardon,1000
Committee to Elect Dan Forest,1000
Committee to Elect Chris Nunnally,1000
Committee to Elect Chadwick Howard ,1000
Committee to Elect Brad Hessel,1000
Committee to Elect Allen Edwards,1000
Committee To Elect Houston Barrow,1000
Committe To Elect Bob Byrd,1000
Comittee to elect Robert Clark Jenkins,1000
Cockerham For Mayor,1000
"Coastal Conservation Association of NC, Inc.",1000
Civitas Institute,1000
Civitas Action,1000
Citizens to Elect James D. Gailliard,1000
Citizens to Elect Chip Hughes,1000
Citizens for Tamara Barringer,1000
Citizens for Sig Hutchinson,1000
Citizens for Joey Davis,1000
Citizens for Donnie Harrison,1000
Citizens for Art,1000
Chatham County Republican Party ,1000
Cecil Brockman for NC House,1000
"Carolina Leadership Coalition, Inc.",1000
Cabarus County Democratic Party,1000
Cabarrus County Democratic Party ,1000
CT,1000
Brian S Nason MBA CRPC,1000
Bray Creech,1000
BoykinForHouse,1000
Basson for NC,1000
Bass for Currituck,1000
Barrett for Schools,1000
Ballantyne Breakfast Club Leadership,1000
BadVoter,1000
Ashton Clemmons for NC,1000
Arin Wilhelm for NC State Senate,1000
Allegra Collins for Judge,1000
Alissa Batts for NC House,1000
Alderman Jeffrey Odham,1000
Al-pam,1000
Aim Higher Now NC,1000
Action NC,1000
AMERICAN CONSERVATIVE UNION,1000
 the Committee to Elect Shad Higgins for Sheriff Buncombe County 2018,1000
,1000
"HOUSE MAJORITY PAC, (202) 849-6052, AND PRIORITIES USA ACTION, (302) 469-3772. NOT AUTHORIZED BY ANY CANDIDATE OR CANDIDATE’S COMMITTEE.",999
Caldwell County Democratic Party,999
the Committee to Elect Beverly R. Spencer,998
FreedomWorks for America. Not authorized by any candidate or candidate's committee.,998
the Office of Rep. Virginia Foxx,997
Environmental Defense Action Fund,996
Jen Mangrum for NC Senate,995
Wesley Harris for NC,994
Citizens to Elect Kathy Harrington,994
Rhonda for NC,990
the Committee to Elect David A. Perry,989
Katie For Carteret,989
the North Carolina Democratic Party and Wiles for House.,983
Mighty Earth,982
Carolina Clean Energy Group,969
The North Carolina Healthcare Association,968
The NewDEAL,967
Black Economic Alliance,963
Elect Bob Kollm for Commissioner,962
Critcher for Clerk,957
"Well•Spring, A Life Plan Community",944
"Political advertisement paid for and approved by Bridget Ziegler for Sarasota County School Board, District 1",944
the City of Charlotte.,931
Greater Greensboro Republican Women's Club,920
Hiatt for Sheriff Campaign Committee,904
the Committee to elect Rosemarie Doshier,881
Shenandoah Valley Battlefields Foundation,873
Leo Phillips for Judge Committee,873
League of Conservation Voters,836
Patagonia ,833
Oklahomans Against SQ 793,786
Chaudhuri for New NC,783
THE COMMITTEE TO ELECT ERICA STANDFIELD BRANDON DISTRICT COURT JUDGE,770
Grand Central Publishing,769
Conservatives for a Stronger Georgia,716
"Winning For Women, Inc.",675
Nathan Manning for Ohio,631
"Friends of Denver Riggleman, Inc.",621
Sponsored by Educators for Change,616
Elect Hugh Weathers Ag Commissioner,600
Friends of Bob Massie,596
Libby Fischer Hellmann,562
One Vote at a Time. Not authorized by any candidate or candidate's committee.,549
Young Invincibles,540
Palmetto Gun Rights,538
FirstQuoteHealth,538
Conservative Institute,529
faireway,528
Post Hill Press,520
Researchers at the Olin Business School,517
"Friends of Justice Gonzalez | 603 Stewart St, #819 Seattle, WA 98101",508
LeadingResponse,505
Sevigny for Congress,500
C Johnson,497
William John Cox,494
the Republican State Leadership Committee,492
Rock Steady Ecommerce,491
The York County Young Republicans ,483
United Moms,477
the Atlantic Coast Pipeline,471
"PT CPA's, PLLC",470
"A Fund to End Corruption, LLC. ",470
American Friends of Magen David Adom,459
The Humane Society of the United States,458
Save the Turtles,449
Paul Mahon,444
"Gail Kasper, Supporting Animal Adoption ",443
Build With Strength,442
Nate McMurray for Congress,432
FuzzWeb,423
"Daniel H. Wolf for Democracy Counts!, Inc., a nonprofit California corporation.",421
Purpose,418
Teflon Film LLC,416
The Welcome. Campaign,412
The NEA Fund,410
Patriotic Drop Shop,410
Financial Advisory For A Better Tomorrow ,409
You're Fired Starters,405
I Love My Freedom,404
"The Christian Broadcasting Network, Inc.",403
"Americans for Peace and Tolerance, a 501(c)(3) national security education non-profit organization, EIN #: 26-3251530",401
Indivisible Action,400
For Truth in Florida LLC,400
Tee Shirt Palace,399
Rebuilding America Now Super PAC,397
Circa,397
Kristina Daley Roegner for Ohio,396
Fuel Freedom Foundation,395
"The Commonwealth Fund, a nonpartisan organization",394
NRA Women,394
John Cox for Governor 2018,393
Foundation for Economic Education,392
Carl Carter for Alabama Senate 11,390
Families For Trump,385
America's Navy,383
Facing Addiction with NCADD,379
International Animal Rescue,377
Strasson Group,375
American Center for Law and Justice,375
Paid for by Carton Council,373
The Cato Institute,371
Sinclair Broadcast Group,370
Friends of Aaron Regunberg,369
"Beachside Media, Inc.",367
Center for Western Priorities,366
Feeding America,364
Turning Point USA,363
NRA,359
RedBlueDivide operated by Today's Growth Consultant,356
News Procession,356
LGBTQ Victory Fund ,356
Proud American Hunter,352
Restoration PAC,350
Affordable Medicare,348
UnitedHealthcare,346
#SeeHer,343
Donald J. Trump - online store for Trump/Pence merchandise and campaign collectibles.,342
Blue Ridge Outdoors Magazine,342
Preventing Tobacco Addiction Foundation,340
Nuclear Matters,340
Civiqs,340
Security Finance Initiative,339
The Leadership Conference on Civil and Human Rights ,338
Joe Canestraro for House,338
"DARK HORSE BROADCASTING, LLC",338
The Greenville County Democratic Party,336
Arthur Winter,336
The Years Project,335
Tenth Amendment Center,334
BizPac Review Inc,334
Dan Bongino,331
2A Gun Magnets,331
the Democratic Governors Association.,330
Jake Hoffman,330
Bill O'Reilly Staff,330
The Texas Monitor,329
Planned Parenthood,329
Planned Parenthood Action Fund.,328
Freeman Ng,327
MegaFood,326
Addicted to Golf,325
DSC Foundation,323
2A4LIFE LLC,323
Animal Petitions,322
Cold Dead hands of America,321
VICELAND,319
The Palestine Institute for Public Diplomacy,319
SEIU,319
 LeftAction,318
Rich Shumate,317
Players Coalition,317
USA Liberty Store,315
Larry Sharpe for Governor,315
