the International Union, United Automobile, Aerospace, and Agricultural Implement Workers of America (UAW).  Not authorized by any candidate.,9
the Committee to Elect Rob Davidson,9
Tubb Canyon Desert Conservancy,9
Sunlight Arizona, a program of the One Arizona, a non-profit 501(c)3 organization,9
People for Solon, Charlie Solon, Treasurer.,9
Les Tillery for City Council District 2 P.O. Box 18162 Huntsville, AL 35804,9
Jeff Reisig for DA.,9
Jamie Kiel Campaign 14696 Hwy 43, Russellville, AL 35653,9
JJ for House 2018,9
Hawthorne Gardening Co. ,9
Friends to Elect Pat Rowe Kerr - Gayla McKinnie, Treasurer,9
Friends of Richard Gottfried,9
Friends of James Skoufis,9
Families & Teachers for Antonio Villaraigosa for Governor 2018, sponsored by California Charter Schools Association Advocates. Committee major funding from Reed Hastings, Eli Broad and Michael Bloomberg. Not authorized by a candidate or a committee controlled by a candidate.,9
Conservation Voters of South Carolina,9
Committee to Elect David Northcutt, P.O. Box 515, Montrose, AL 36559,9
Chris Wilhelm for County Council,9
the House Victory Committee | Ashley Manlove, Treasurer ,8
Tom Stites for State House 2018,8
New York State Laborers' Union,8
Matt Lederer for State Assembly,8
Martin for Arizona,8
Ken King for State Representative,8
Friends of Michele Johnson,8
Friends of Marisabel Cabrera,8
Friends of Josh Green,8
Friends of Jay Edwards,8
Associated Builders & Contractors of Wisconsin,8
Andrew Cuomo for Governor,8
Amie Hoeber for Congress,8
the Daviess County Democratic Party,7
The Frontier Power Company ,7
Texans for Trent Ashby,7
Rob Wittman for Congress,7
Official Funds from the Office of Congressman Tom Reed,7
MARTE NYC,7
George Franklin for Congress,7
Friends of Russ Kenyon,7
Friends of Darrin Camilleri,7
Friends of Christian Miele | Treasurer: Richard "Maynard" Thurfield,7
Andy Kim for Congress,7
the North Carolina Democratic Party and Ric Vandett for NC Senate.,6
the Louisiana Chemical Association,6
friends of John Michael Montgomery 2017,6
YWCA Southern Arizona,6
Solar Rebates,6
Rob O'Brian for State Senate Committee, Grant Schwartz, Treasurer,6
Protect Life a project of the California Catholic Conference, Inc.,6
New York State SRCC,6
Lisa Brown for Congress,6
Jason Rittereiser for Congress,6
Future Generations Advocacy Project,6
Friends of Michael Guest,6
Friends of Melissa Cordeiro,6
Friends of John Olszewski Jr.,6
Friends of Dana Balter,6
Connect Southeast Michigan,6
Coloradans for Fariness,6
Clean Energy Jobs Ohio,6
 Friends for Kelly Rossman-McKinney,6
WIN Energy REMC,5
Texans For Bob Hall,5
SC Club for Growth,5
Raybould for US Senate,5
Political advertisement paid for by the campaign to elect Debbie Wood  3011 20th Avenue Valley, Al. 36854,5
Pam For Senate,5
Ohio AFL CIO,5
Golden for Congress,5
Friends of Rich Funke,5
Friends of Lisa Moore,5
Friends of Dana Nessel ,5
Friends of Aloyse Brown,5
Forward Wyoming,5
Donielle M. Lovelle For State Representative,5
Committee to Elect Jared Golden,5
Ben Pak for Board of Equalization,5
American Federation of Teachers,5
Advance California,5
the Brownsberger Committee,4
and approved by Anderson Volunteer Committee.,4
Will Freeman for SC House 110,4
The Commonwealth Foundation,4
South King County Deserves Better,4
Snyder for AK House,4
Sharon Hirsch Campaign.,4
Sara Michael for Missouri, Maxwell Rademan Treasurer,4
SEIU Healthcare Illinois & Indiana,4
Paid For By Friends Of Marilyn Mosby,4
NEA-New Mexico EdPAC,4
Maryland REALTORS® Political Fund, Michael Cerrito Treasurer,4
Louisiana Association of Educators,4
Kulkarni for Congress,4
Kevin Daley for State Senate,4
Friends of Warren Petersen,4
Friends of Tom Barrett, PO Box 121, Charlotte, MI 48813,4
Friends of Sam Bell,4
Friends of Nino Mangione. Lawrence Hineline, Treasurer.,4
Friends of Kent Glesener 2018,4
Friends of Frank Barger, P.O. Box 2053, Huntsville, AL 35804,4
Friends for Steve Sisolak,4
Friends for Steve Sisioak,4
Friends for Miller-Meeks,4
Dr. Kim Schrier for Congress,4
Dominion Energy,4
DePizzo For Congress,4
David Trone For Congress, Inc. ,4
Conservatives for Toma,4
Committee to Elect Joan Carter Conway, Gerald Stinnette, Treasurer,4
Collier for Lt. Governor ,4
Aric Nesbitt for State Senate,4
Allied Progress Action,4
the Beverly Powell Campaign,3
official funds authorized by the House of Representatives,3
Todd Litton for Congress,3
The Greg Bonnen Campaign,3
Teamsters Local 688 PAC,3
Robert Nichols for Texas Senate,3
Pete Harckham for Senate,3
Patriot Majority USA,3
Paid and Prepared by Friends of Peter McLaughlin  3425 Sixteenth Ave S, Mpls, MN 55407,3
McLeod-Skinner for Oregon,3
Kaul for Attorney General,3
Julie Johnson for Texas,3
Henderson for State House Campaign,3
Healthy Nevada PAC,3
Friends of Sam Givhan, 100 Washington St., Huntsville, AL 35801,3
Friends of Kirby Delauter,3
Friends of Dak Hardwick,3
Friends for Yvanna Cancela,3
Donald B Mayhew FSR; Donald B Mayhew, Treasurer,3
DAN HAMILITON FOR CONGRESS,3
Committee to Elect Kyle Guyton,3
Citizens Against Nuclear Bailouts,3
California Life Sciences Association,3
CalChamber and the Civil Justice Association of California,3
American Civil Liberties Union,3
Alliance for a Better Minnesota Action Fund,3
21st District Democratic Team,3
the Committee to Elect Jacqueline Gray Miller,2
Working America,2
Williams for Judge,2
Washington State Democratic Party,2
Vote4DA Campaign, a project of the ACLU of California,2
VENEKLASEN FOR OUR FUTURE. DON DEVITO, TREASURER,2
Taylor Sappington For Change,2
Sarah Godlewski for State Treasurer,2
Roger Victory for State Senate,2
Repair Our Schools Now Coalition,2
Pol. Ad Texans for Greg Abbott,2
Paulding Putnam Electric Coop,2
Paid for by Jeff Sheehy for Supervisor June 2018. Financial disclosures are available at the San Francisco Ethics Commission website.,2
Paid for by Jeff Irwin for State Senate ,2
Ouachita Electric Cooperative ,2
Nicole for New York,2
NYS SRCC,2
NYC Department of Health and Mental Hygiene,2
Mid Atlantic LECET,2
Marylanders for Craig Wolf,2
Lee White,2
Larsen Jay for Knox County Commission, Kirk Huddleston, Treasurer,2
Kumar for Council 2018 (FPPC Id 1364692),2
Kind for Congress,2
Kaczmarek for Sheriff Committee ,2
Jef Fincher Admin Melvin for Georgia,2
Ian Shetron for State House | PO Box 60 | Flushing, MI 48433,2
Grow Louisiana Coalition,2
Gregory For Missouri, LK "Chip" Wood Treasurer.,2
Gabriel Nila Campaign,2
Friends of William Tanoos,2
Friends of Meredith Wellington,2
Friends of Amy Blank,2
Friends of Aaron Regunberg,2
Forest Fire Facts,2
Equality Texas.,2
Dan Miller for Sheriff ,2
Clarissa Silva Campaign, Patricia Deaton, Treasurer, P.O. Box 532225, Harlingen, Texas 78553, in voluntary with the Fair Campaigns Practices Act.,2
Citizens for Saladino,2
Citizens for Maldonado,2
Citizens Supporting Jeff Fine,2
Christi Craddick Campaign,2
Cheri Helt for State Representative,2
CTE Kevin Coleman for Michigan,2
Brian White for State House,2
Atlanta REALTORS®,2
Alec J Rappleyea,2
Adam Milasincic Campaign,2
the Westchester-Playa Democratic Club.,1
the Republican Assembly Campaign Committee,1
the Invest in Education Committee. Not authorized by any candidate.,1
the Committee to Elect Tammy Savoie,1
the American Civil Liberties Union Foundation of Arizona,1
Zumbach for Agriculture,1
Zack Fields for State House ,1
Yost for Assembly,1
Wynn For Georgia,1
Williams for Senate 34,1
Watts for Congress,1
Vote Colleen Ebacher, Hollis Mooney, Treasurer,1
Virginia Families PAC,1
Utahns for Igor,1
Tom Cole for Congress,1
Tim Greimel for Congress,1
The Committee to Elect Terrence Murphy ,1
The Committee to Elect Jonathan Ambler,1
Team Justin Brown, Danette Sherrell, Treasurer,1
Take Back Our Republic,1
Susan Ellenberg for Santa Clara County Supervisor FPPC# 1394541,1
Supporters of Jack D. Franks,1
Sophe Cook Pope for Board of Education,1
Sloan for Arizona,1
Singh for Congress,1
Sand for North Dakota - Chris Hanson, Treasurer,1
RNY Initiative,1
Protect Michigan Jobs with regulated funds ,1
Pechefsky for Congress,1
Patricia Kane RN for Assembly,1
Paid for by Friends of Josh Newman Opposed to the Recall. Committee major funding from: California Democratic Party, Californians for Better Communities, Opposing the Recall of Senator Josh Newman, sponsored by California Alliance for Jobs and the State Building & Construction Trades Council of California California Teachers Association,1
Paid for by Dave Jones for Attorney General 2018,1
No New Oklahoma Taxes,1
New Mexico Oil & Gas Association,1
New Direction PAC,1
Moore for West Virginia,1
Kari Powell for PSC,1
Kanew for Congress,1
Joe Shirley, Jr., for President 2018,1
Jobs for Montana PAC Lorna Kuney, Treasurer PO Box 1538 Helena, MT 59624,1
Jim Carter Campaign,1
Jesse Gabriel for Assembly 2018 - FPPC ID No. 1400729 and Elect Jesse Gabriel for Assembly 2018 - FPPC ID No.1402641,1
Jesse Colvin for Congress,1
Jennifer Plumb Committee to Elect,1
Jefferson County Democratic Party, Box 10522, Birmingham 35202,1
Jacobs for State Senate,1
JUSTIN FAREED FOR CONGRESS - FEC# C00572560,1
Home Improvement Deal,1
Grego for House 2018 ,1
Government House,1
Friends of Thomas "Mac" Middleton, Earle Knapp, Jr., Treasurer,1
Friends of LaVelle Compton for House District 90,1
Friends of Josie Raymond,1
Friends of Joel Rubin - Samuel Agger, Treasurer,1
Friends of Joe Cibellis for Oceanside Sanitation,1
Friends of Derek Kawakami PO Box 3136, Līhu`e HI 96766,1
Friends of David Ryden. Taylor Gomez, Treasurer.,1
Friends of Anne Brown,1
Esposito & Surano for Bernards Township Committee,1
Elect Steve Barnett,1
Elect Ryan Berman - 2525 S. Telegraph Rd, Ste 100, Bloomfield Hills, MI 48302,1
Eileen Wright for Mayor,1
Dave LaRock for Delegate,1
Conservation Colorado,1
Congressman Mark Walker,1
Committee to Elect Judge Sharon Marchman,1
Committee to Elect Charlesetta Wilson,1
Chemung County Legislator Rodney J. Strange,1
Change Annapolis PAC,1
Chad Williams for Tennessee,1
Campaign to Elect Marisue Hilliard for Georgia State Senate District 46,1
Campaign for Ronald Bell (Voteronbell.org),1
CRISTINA GARCIA FOR ASSEMBLY 2018  FPPC ID 1393064,1
CALinnovates,1
By Authority: Maryland House Democratic Caucus Committee; Gail E. Smith, Treasurer.,1
Brian McClendon for Kansas Committee,1
Bob Hooper for State Representative,1
the Progressive Change Campaign Committee PAC and not authorized by any candidate or candidate's committee. Contributions to the PCCC are not deductible as charitable contributions for federal income tax purposes.,0
the Omega Institute,0
the North Carolina Democratic Party and Tim Barnsback for North Carolina House.,0
the Native American Rights Fund, the oldest and largest non-profit law firm protecting the rights of Native tribes and people.,0
the National League of Cities,0
the Maine AFL/CIO. Not authorized or paid for by any candidate.,0
the Garrett for Statehouse Committee ,0
the Foundation for Independent Voter Education,0
the Devin Nunes Campaign Committee,0
the Democratic Legislative Campaign Committee,0
the DC Fiscal Policy Institute,0
the Committee to Elect Zaragoza for I.I.D. Director Division #5 2018,0
the Committee to Elect Michelle Ciccolo.,0
the Committee to Elect Carolyn Parker, 2600 E. Meighan Blvd., Gadsden, AL 35903,0
the Colorado Democratic Party,0
the Climate Museum,0
the Center For American Entrepreneurship.,0
the California School Boards Association,0
paid by committee to elect Craig Harris for County Commissioner,0
ifoyer,0
candidates that Ty Javellana supports,0
by GroundUp. Not authorized by any campaign, committee, or PAC.,0
and approved by Vito Sheeley for State House District 70,0
and approved by Sean Mitchell, Democrat, for St. Lucie County Commission,0
and approved by Oren L. Miller, Democrat, for FL House,0
Zoë Bands,0
ZAMORA for NM STATE REPRESENTATIVE DISTRICT 63 -Steve Hudson Treasurer,0
Youth Progressive Action Catalyst,0
Yes On 793, Inc. 4 NE 10th St #434 OKC, OK 73104 (405)510-7946,0
Wyoming Hunters and Anglers Alliance 501 (c) (4),0
World Food Program USA,0
Working Assets Funding Service, Inc. on behalf of itself and its affiliate, CREDO Mobile, Inc.,0
Wild Olympics Campaign,0
WhyHunger,0
Western Communities of West Palm Beach Democratic Club,0
Weninger for AZ.,0
Waterway Boat Lift Covers,0
Waters Kraus & Paul,0
Vulcan Inc.,0
Voters Decide,0
Vote Mimi Methvin,0
Vinyasun Corporation a solar energy and battery storage installation company.,0
VerifiKado LLC - We assume responsability for everything we publish under the VerifiKado brand.,0
VICELAND,0
VERV EXP, LLC,0
Urbina for County Commissioner,0
Upton for All of Us.,0
UNICEF USA,0
UCR,0
Tyler Whyte,0
True Science Holdings, LLC.,0
TruOcean,0
Tricia Duncan of Keep Families Together,0
Trendy Now Shop,0
Top Conservative Network,0
Tony for Wisconsin. ,0
Tommy Thompson for Marion County Judge,0
Todd Greeson for Circuit Clerk, PO Box 159 Ider, AL 35981.,0
ThoughtFull Enterprises, Inc.,0
Thomas Hawkins,0
Theresa Gasper for Congress,0
The following news article is just for political news information and not intended to influence any particular people or section of society.,0
The Unofficial Bill O'Reilly Fan Club,0
The Simple Life Store,0
The Rutherford Institute,0
The Refugee Center Online,0
The Pragmatic Libertarian,0
The Office of State Representative Amber Mariano, District 36,0
The Office of Mayor Ted Wheeler ,0
The Niskanen Center,0
The National Organization for the Reform of Marijuana Laws,0
The Independent Republicans of Wyoming, a registered 501(c)(4). The Independent Republicans of Wyoming is not affiliated with any political campaign and this website was not authorized by any candidate or candidate's committee.,0
The Fortune Society,0
The Fernando Padron Campaign,0
The Committer to elect Petrus/Sanes ,0
The Committee to Elect Cindy Lake,0
The Committee To Elect Lisa Ring,0
The Claremont Independent,0
The Christian Broadcasting Network, Inc.,0
The Arena PAC,0
The Anti-Socialist,0
The American Journal of Managed Care,0
The #News,0
Texans for Dan Patrick,0
Terry for Arizona,0
Tenth Amendment Center,0
Tammy Baldwin for Senate,0
TB Reporter does not run political ads on Facebook. We are a news site that writes about politics. If you think this is an ad, it is not. It is a story about politics or a politician. The ads are paid for by Ragranok Group but they are not political ads. This is to comply with Facebook requirements,0
T'ruah: The Rabbinic Call for Human Rights,0
T Love Inc,0
Sustainable Politician Project,0
Susie Lee for Congress,0
Susan Valdes, Democrat, for Florida house District 62,0
SupChina,0
Stewart for Senate, Inc. ,0
Steve Vernon,0
Steve Dunwoody for Assembly,0
State Senator Peter MacGregor,0
Staance, an open community on a mission to bring transparency to political polling,0
Solstice,0
Society To End The Entitlement Mentality,0
Smartwool,0
Smart Politics,0
Silvio Palermo for Sheriff,0
Shirley Brown for Sarasota County School Board - District 4,0
Shevrin Jones, Democrat for Florida House, District 101,0
Shayan Elahi for Irving Place 6 Campaign, Bhavik Amidas, Treasurer,0
Shaun Kunz for Seminole Soil & Water Conservation District: Group 5,0
Seguros Medicos al Instante,0
Seafood Harvesters of America,0
Scott Ferguson for AMA Board of Trustees,0
Scott Davis for Tennessee.  Tom Baker, Treasurer.,0
Save the Redwoods League,0
Salem Media Group Tampa Sarasota,0
S. Daniel Carter,0
Ryan Hampton,0
Ryan A. Farber For President,0
RoundTable Politics,0
Ro for Congress,0
Right on Campus Inc.,0
Resistance School,0
Repubtards,0
Reframed PR & Marketing,0
Reform Austin Inc.,0
RedBlueTracker,0
Rebecca Purington Campaign.  Missy Horesh, Treasurer.,0
Realtors® Political Advocacy Committee,0
Re-Elect Jim C. Hanks for IID - Division 3,0
Ray Pilon Republican for Florida House District 72,0
Raising Colorado,0
Purpose Campaigns,0
Purpose,0
Protectors of the Wood LLC,0
Project Republic Today,0
Progress Michigan,0
Prof.V.Randall,0
Prison Fellowship,0
Primary The Ruling Class Political Action Committee,0
Preventing Tobacco Addiction Foundation,0
Premiere Collectibles,0
Population Connection,0
Politicon,0
Political advertisement paid for and approved by Manny Diaz, Republican, for State Senate, District 36.,0
Political Front,0
Plant City Main Street,0
Plant City Jobs,0
Pincause,0
Phil Beracha for Margate City Commissioner Seat 3,0
Peter G. Peterson Foundation,0
Perry Berkowitz Campaign,0
Peace Club,0
Patriot Style,0
Patient's Rights Action Fund,0
Parks Project,0
Paleo Politico News,0
Paid for by Seth Levy for District Attorney, Chris McCarthy Treasurer, P.O. Box 31, Brunswick, ME,0
Paid for by Public Safety for a Safer Santa Clara Supporting Hirokawa for Sheriff 2018, sponsored by the Deputy Sheriffs’ Association of Santa Clara County. Not authorized by a candidate or a committee controlled by a candidate. Committee major funding from Deputy Sheriffs’ Association of Santa Clara County.,0
Paid for by Mindy Koch for Florida House District 81,0
Paid for by Friends of Copey Grantham,0
Paid for by Be a Hero PAC,0
Paid Political Advertisement, Paid for and Approved by Shawn R. Frost for Indian River County School Board,0
PETA,0
PATE FOR IOWA,0
PACE is Working,0
Outschool,0
Outrider Foundation,0
Organizing for Action,0
One Nation Design,0
Nunyo Demasio,0
Noticias Xtra Media,0
North Carolina Democratic Party.,0
Normals Are Pissed,0
Norm Novitsky,0
NextGen Climate Action,0
Next Level Digital,0
New Yorkers Together. This communication was not expressly authorized or requested by any candidate or by any candidate's political committees or any of its agents.,0
New American Economy,0
Nevada State Democratic Party,0
Naytev,0
National Clean Energy Week ,0
Nate Kilton, Plant City Commissioner,0
Nasty Woman Cosmetics,0
Nano Vision,0
Nancy Guy for Bismarck City Commission,0
NYS Senate Republican Campaign Committee,0
NC Common Ground,0
My Prairie Reader,0
Muslim Legal Fund of America,0
Morrisey for Senate, Inc.,0
Montanans for Tester,0
Mitchell Blatt, Political Columnist,0
Mitch Novick,0
Mike Moore, Republican for Pasco County Commissioner District 2,0
Middle Class Voices,0
Michele Guyton for Baltimore County,0
Micah Ali - Compton School Board 2019,0
Mic,0
Mercy Corps,0
Menomonee Falls Action Team, Chris Byrnes, Chair,0
Menendez for Senate,0
Mendelson for Chairman 2018,0
McKenzie Cantrell for State Representative,0
Matt Zerrusen,0
Matt Nye, Brevard County Watchdog,0
Matt Longjohn for Congress,0
Massoumi Web Holdings LLC,0
Mark Johnson Candidate for Hernando County School Dist. 1,0
Mark DeShong,0
Mark Beltavski,0
Mariah Phillips for Congress,0
Maple Heights African American Gazette,0
Mallory Hagan for Congress,0
Major funding by ACLU and ACLU of Northern California,0
Maine Coast Heritage Trust,0
Main Street Investors Coalition,0
Luis Saldana,0
Lock Him Up T Shirts,0
Live Action,0
Little Dictator Game,0
Libertarian Party of Philadelphia,0
Lemony Tree,0
LeadJig,0
Lead the Change Now,0
Latino Tax Professionals Association,0
Larry's Ice Cream,0
L.E.A.D. Nation & the South Florida Youth Summit,0
Kyle M. Woodman,0
Knock Knock,0
Kirk deViere Campaign Committee,0
Kimberly-Carr Home Designs,0
Kimberly Ellis,0
Kim Porteous,0
Keyes for Wisconsin, Treasurer:  David Luebke,0
Key West The Newspaper ,0
Key West Bicycle Association, a cycling advocacy group located in Key West, FL,0
Kevin de León for U.S. Senate,0
Kerri Evelyn Harris for Delaware,0
Kennett Area Democrats, Dale LaBar, Treasurer,0
Kelly For District 87,0
Kathleen Riebe for Senate 8,0
Katherine Cabaniss Campaign,0
Kate Brophy McGee AZ - Senate,0
Kansans for a Democratic House, Adam Lusker, Treasurer,0
Justin Haskins,0
Julie 2019, Kate Conetta treasurer.,0
Julia Brownley for Congress,0
Jon Uman for Alachua County Judge, Group 2, non partisan. This page is managed and maintained by the Committee of Responsible Persons to elect Jon Uman for Alachua County Judge, Group 2, nonpartisan.,0
John Shearon, 810 Wilson Road, Clanton, AL 35045,0
John Perez,0
John Haste for State Senate 2018,0
Joe McBride for State Supreme Court Judge,0
Job Creators Network,0
Joan Greene for Congress,0
Jill Luke for North Port City Commission, District 5 ,0
Jerry Calderon,0
Jeremy Reynolds for Dunedin commission seat 4,0
Jenae for SD,0
Jeff Greene, Democrat, for Governor,0
Jeanette Largent,0
Janet Garrett for Congress,0
James Linwood Schulman, Democrat for State Representative, District 115,0
JA Moore for SC,0
J. Scott Bayne for Davie Town Council, District 3,0
J Matthew Ash,0
Ixnay PAC. Not authorized by any candidate, or candidate's committee. ,0
Instagram,0
Indivisible Project and not authorized by any candidate or candidate's committee.,0
Indivisible Project,0
Indivisible Action Tampa Bay,0
Humane Society International,0
House Majority PAC,0
Hillsborough Community Protection Coalition,0
Hilary Caskey, President  PABAC Charlotte County,0
Highlands County Republican Executive Committee,0
Henry Gomez, Webmaster Babalu Blog. ,0
Hello Resistance,0
Heifer International,0
Headline Shirts,0
Harry Cohen for Mayor (nonpartisan),0
Harder for Congress,0
Hanabusa for Governor,0
Guardians of Old Daphne neighborhood group in downtown Daphne, Alabama,0
Great Public Schools for US,0
Government Poli-Tees,0
Goods Unite Us, Inc.,0
Global Citizen,0
Gil Montalvo Jr.,0
Giffords.,0
Get Money Out - Maryland, an all-volunteer group seeking reforms so that so that all citizens have equal access to the ballot and an equal say in governance.,0
Gary Walker,0
Gary Siegwarth,0
Gabe for Council, Bill Baker, Treasurer,0
Friends of Tyler Murphy,0
Friends of Thomas Morgan, 1432 Wickham, Lansing, MI 48906,0
Friends of Sheriff Scott Jones 2018,0
Friends of Rodney J. Strange,0
Friends of Robbyn Lewis. Gigi Eggers, Treasurer. ,0
Friends of Nick Schroer, Josh Murphy - Treasurer,0
Friends of Nick Forrester; Jamey Davis, Treasurer ,0
Friends of Lammis Vargas,0
Friends of Joni Crane,0
Friends of John Sarbanes,0
Friends of Jim Mathias. Donna Richardson West, Treasurer,0
Friends of James Howard, William C. Woodcock, Treasurer,0
Friends of James Glorioso Jr for Montgomery County Sheriff,0
Friends of Gina Raimondo.,0
Friends of Dana Beyer,0
Friends of Dan Kildee,0
Friends of Ben Jealous, Jason Small, Treasurer,0
Friends of Andy Szekely,0
Friends For Locke Thompson, Sherry Mariea Treasurer.,0
Friends For Chris Dodson Dinkins, Paul Fitzwater Treasurer,0
FreedomWorks,0
Free to be Kids,0
Francis Paul Ripp,0
Framed Tweets Inc,0
Formerly Incarcerated College Graduates Network,0
Flow,0
Flippable,0
Flanders for U.S. Senate,0
Fitzgerald for Congress, Inc.,0
First Liberty Institute,0
Fipple,0
Fine Political Items,0
Figueroa for Ulster,0
Fighting for Our Future. This communication was not expressly authorized or requested by any candidate or by any candidate's political committees or any of its agents.,0
Feinstein For Senate 2018,0
Eric Eliason for Congress,0
Englewood Recall Committee,0
Emily Sirota for Colorado,0
Elizabeth Pannill Fletcher for Congress,0
Elect Kathy Hoffman for Superintendent,0
Edward O'Connor,0
Eastern State Penitentiary,0
END THE NRA. NOT AUTHORIZED BY ANY CANDIDATE OR COMMITTEE. ,0
DuPage Libertarians,0
Drake for District 23, K. Upchurch, Treasurer,0
Dowling for Auditor,0
Donnelly for Indiana,0
Donald Scott perri,0
Donald J. Trump for President, Inc,0
Donald J. Trump - online store for campaign gear,0
Don't Slack,0
Diversity Incorporated ,0
Diego Rodriguez Nava,0
Diana Arezzo, Ph.D., concerned private citizen, solely for the purpose of increasing post reach,0
Devoted,0
Devin Sena,0
Derek Armstead,0
Democratic Volunteers in District 2 Duval County,0
Democratic Environmental Caucus of Florida, Pasco Chapter,0
Decaying In The Void,0
Dean Obeidallah,0
De On Stupart,0
David Landfair for Mayor,0
Dave Clegg For Congress,0
Dan Kohl for Congress,0
Dale Coco MD EID Irrigation Board of Directors (ID# 1400444),0
Curds,0
Craig Simon on behalf of the Indaba Application Network... "Building Better Tools for Better Democracies",0
Courage Campaign,0
Councilmember Anna Hochkammer,0
Councilman AJ Beephan,0
Council for Responsible Nutrition,0
Consolidated Cooperative ,0
Conservative Majority Fund,0
Conservative Investor Daily,0
Conor Bentley,0
Connell Crooms for Mayor,0
Connected Commerce Council (3C),0
Congressional Black Caucus PAC,0
Concerned Citizen David Townsend,0
Committee to Elect Sam Hatton,0
Committee to Elect Rob Davidson,0
Committee to Elect Neil Rafferty P.O. Box 321579 Birmingham, Alabama 35232,0
Committee to Elect Marc Snyder,0
Committee to Elect Jon Santiago	,0
Committee to Elect Jim Brochin,0
Committee to Elect Brent Latham Mayor of North Bay Village,0
Committee for Alameda County Childcare & Early Education,0
Committee To Elect Victoria McKay Kennison,0
Committee To Elect Phil Oxendine ,0
ClubRESIST.  All ideas and opinions expressed herein are solely those of ClubRESIST. ClubRESIST does not warrant or make any representations concerning the accuracy, likely results, or reliability of the use of the materials on its Internet web site.,0
Clint Townsend,0
Citizens for Martin T. Tully,0
Citizens for Kash Jackson,0
Citizens For Harry He Assembly 2018,0
Citizens Congress Inc., a 501 C4 non-partisan, non-profit organizetion registered in the state of Florida.,0
Cindy for Georgia ,0
Church and Community Development for All People,0
Christina Kaleiwahea,0
Chrissy Houlahan for Congress,0
Chris Pappas for Congress,0
Chloe Sowers for District 45,0
Chatham County Republican Party ,0
Center for Reproductive Rights,0
Center for American Progress,0
Carol Marple for Shawnee County Commissioner,0
Cardozo School of Law,0
Campaign Fund of Derek T Ashcraft ,0
Campaign Fund For Calen Studler,0
Californians for Safe and Affordable Housing,0
California Senate Republican Caucus,0
California Rifle & Pistol Association Political Action Committee,0
California Rifle & Pistol Association,0
Business Forward,0
Burke-Paine Society,0
Build With Strength,0
Brian Harrington for Laramie City Council,0
Brave Path Media LLC,0
Bottlepops USA,0
Born Red,0
Bobby for Congress.  FEC Committee ID: C00649533,0
