the Republican Party of Florida.  Not authorized by any candidate or candidate's committee.,500000
Say No to 13,200000
SEIU Florida State Council,200000
NumbersUSA,200000
Treasure Florida PC,100000
Floridians for a Fair Democracy,100000
"Fiorella Insurance Agency, Inc.",100000
Amendment 2 is For Everybody,100000
Holden 2018,99801
Voters in Charge,50000
MARCO RUBIO FOR SENATE,50000
"Bryan Avila, Republican, for State Representative, District 111",50000
Alliance for Climate Education,50000
"Miami Freedom Park Political Committee, Inc., 2600 South Douglas Road, Suite #900, Coral Gables, Florida 33134.",48215
"electioneering communication by Floridians for Ethics and Truth in Politics 1700 North Monroe Street Ste 11-297 Tallahassee, FL 32303",10000
"and approved by the Committee to Elect Dean Mosley, nonpartisan candidate for judge. Ninth Judicial Circuit (Orange and Osceola) -Group 41.",10000
"and approved by Oren L. Miller, Democrat, for FL House",10000
We Built This,10000
Victoria Mitchner for Brevard County Commission ,10000
Tom Copeland for Lake Worth Commission,10000
Southern Poverty Law Center,10000
Southern Alliance for Clean Energy.,10000
"ROBERT S WEINROTH, DEMOCRAT, FOR COUNTY COMMISSION, DISTRICT 4",10000
"Quality Schools for the Future, PC, 2680 Bellingham Ct. Cape Coral, FL 33991",10000
"Political advertisement paid for and approved by Michael “Mike” Sobel for Mayor of Pompano Beach, non-partisan election.",10000
"Political Advertisement Paid For And Approved By Linda L. Gaustad For Circuit Judge, Circuit 7, Group 15. Nonpartisan.",10000
No Labels Action. Not authorized by any candidate or candidate's committee.,10000
"Liv Coleman, Democrat, for State Representative, District 73",10000
"Lisa Cane, Candidate for Pinellas County School Board District 2 at Large (Non-Partisan) ",10000
League of Women Voters of Florida Education Fund,10000
Lauren Baer for Congress,10000
"Jimmy Patronis, Republican, for Chief Financial Officer",10000
Jeffrey Marc Siskind,10000
Florida Gun Rights PAC,10000
Florida Democratic Party,10000
"Delores Hogan Johnson for Florida House District 84, Democrat",10000
Deborah M. Hooker for County Court Judge ,10000
Concealed Online,10000
Community Change Voters,10000
"Citizens for Truth About Amendment 3, Inc., 610 S. Boulevard, Tampa, FL 33606",10000
Chad Chronister for Hillsborough County Sheriff,10000
Cafe con Leche con AARP Florida,10000
Broward College ,10000
Bill Nelson for U.S. Senate,10000
BILL NELSON FOR U.S. SENATE,10000
"Atwell Media, LLC",10000
"Anthony Sabatini, Republican for Florida House, District 32",10000
American Opportunity PAC. Not authorized by any candidate or candidate's committee.,10000
Alan Youngblood for Seminole County School Board - District 1,10000
Adam Michelin Candidate for Commissioner District 4 Osceola County,10000
AARP Florida,10000
"Service Employees International Union, Local 32BJ",9999
One Florida Foundation,9999
Greg Green For Hillsborough County Court Judge Group 2,9996
Ardila Law Firm LLC,9994
Collier County Democratic Party,9984
Debbie for Congress and DCCC,9980
"Political advertisement, paid for and approved by Joe Gruters, Republican for Florida State Senate, District 23",9956
Nicole Carr for School Board,9897
Flagler County Republican Executive Committee,9781
The Leadership Conference Education Fund,7311
MomsRising Together,6424
"and approved by Manny Diaz Jr., Republican for State Senate, District 36.",5000
and approved by Craig DeThomasis for Alachua County Judge,5000
"Wayne Culver - non-partisan for County Court Judge, Group 2",5000
The McKinney Law Group,5000
Shelia Arnett Campaign for Marion County School Board District 5,5000
"Sarah Willis for 15th Judicial Circuit Court Judge, Group 25.",5000
"Melissa Martin, Democrat, for FL Senate District 14",5000
Knock The Vote,5000
Jennifer Casey for Duval County Soil and Water,5000
"Jeff Triplett, nonpartisan for Sanford Mayor",5000
Jeff Triplett for Mayor of Sanford,5000
Insurance Brokers Direct Inc.,5000
Home Professionals,5000
Heath Rassner for State Representative,5000
Florida Republican Senatorial Campaign Committee,5000
Florida Planned Parenthood PAC,5000
"Florida Conservation Voters Action Fund, 1700 N. Monroe St., #11-286, Tallahassee, FL 32303 independently of any candidate.  Not approved by any candidate.",5000
Dustin Daniels for Mayor,5000
Derby Lane,5000
"Denise Horland, Nonpartisan, Candidate for Plantation City Council Group 2",5000
David Singer Palmetto Bay Council Seat 2,5000
"Carlos Guillermo Smith, Democrat, for Florida House District 49",5000
Carlos Curbelo Congress,5000
"Beth Ramsay-Vickrey for Key West Utility Board, Seat D",5000
"Anna V. Eskamani, Democrat, for Florida House 47 ",5000
Andrew Jeng for City of Kissimmee Commission Seat 2,5000
Global Video Pros,4976
We Are The Mighty,3809
Mi Familia Vota,2704
NARAL Pro-Choice America,2644
Beto for Texas,1630
мои личные средства в рекламу моей компании,1000
the NRCC and not authorized by any candidate or candidate’s committee.,1000
campaign to elect Michael Ray to the West Volusia Hospital Authority,1000
"and approved by Robyn E. Stone for Indian River County Judge, Group 2",1000
and approved by John George Beckford for City Commission Seat 2 non partisan,1000
and approved by Brent Latham for Mayor of North Bay Village.,1000
"and approved by Andrew Davis, Democrat, for Hillsborough County Commission, District 4.",1000
"Will Robinson, Republican, for State Representative",1000
"Vote YES for the Sarasota County Legacy Trail Extension, 1680 Fruitville Road #502, Sarasota, FL 34236.",1000
"Vicki Anderson-Ferrin for Winter Springs City Commissioner, Seat 2",1000
U.S. Sugar,1000
Thomas Hawkins,1000
The Western Journal,1000
The Pasco Democratic Party,1000
The Democratic Coalition,1000
"Tara M. O'Connor for Pasco County School Board, District 5",1000
Tampa Bay Waterkeeper,1000
Sponsored By The Florida Republican Senatorial Campaign Committee,1000
Southwest Florida Water Management District,1000
Roosevelt Mcclary III for Lauderdale Lakes City Commission,1000
"Rob Levy for Florida State Senate District 25, Democrat",1000
Priorities USA Action. (302) 469-3772. Not authorized by any candidate or candidate's committee.,1000
Pharmacists United for Truth and Transparency,1000
"Pasha Baker for Mayor of Sanford, FL.",1000
Ocean And Co,1000
No one - my personal opinons,1000
Need to Impeach,1000
Murray Insurance Agency,1000
Misty Servia,1000
"Melton H. Little, Democrat for County Commission District 4",1000
Matt Fleming for Brevard County Commission,1000
"Matt Caldwell, Republican, for Commissioner of Agriculture",1000
Marybel Pugliese Alvarez,1000
Mario Diaz-Balart for Congress,1000
"Maggie's List, a Political Action Committee",1000
"Lee Mangold, Democrat, for Florida House 28",1000
"Lawrence Sofield, Non-Partisan for Sunrise City Commission, Group D",1000
Kevin Reid for DeLand Commission ,1000
"Keith Trace for St. Cloud City Council, Seat 5",1000
"Judge George ""Jorge"" Sarduy",1000
"Juan Alfonso Fernandez-Barquin, Republican, for State Representative, District 119",1000
Josh Messinger for Neptune Beach City Council ,1000
Jonathan Parker For State Representative,1000
"Jeremy Ring, Democrat, for Chief Financial Officer",1000
"Helen Henderson, Democrat, for St. Lucie County Commission, District 4",1000
"Gregory Caudill for Alachua County Commissioner, District 2",1000
Greg Steube Congressional Committee,1000
"George Neugent, Candidate for Marathon City Council",1000
Floridians For Clean Water,1000
Florida Daily,1000
"Equality Florida Action PAC, P.O. Box 13184, Saint Petersburg, FL 33733",1000
"Elizabeth Andersen, candidate for School Board district 2",1000
"Elect Ralph De palma Keys Mosquito Control Commissioner, District 2 (D)",1000
Eduardo Soto PA & Eduardo Soto & Associates ,1000
Dr Matt Stewart for School Board,1000
"Doug Maesk, candidate for Tamarac City Commissioner District 4.",1000
Docs 4 Patient Care Foundation,1000
"Digna Cabral, for Doral Council, Seat 4",1000
Dawn Douglas for House District 67,1000
"David Straz for Mayor, Non-Partisan",1000
"David Smith, Republican, for State Representative",1000
David Shapiro for Congress,1000
David Grimm for Orange County School Board District 2,1000
"DARK HORSE BROADCASTING, LLC",1000
Cynthia D. Smith Candidate for School Board District 4,1000
"Committee to Advance Constitutional Values, 4343 West Flagler Street, Suite 400, Miami, FL 33134",1000
Calm Effect,1000
Butch Hansen for City Council ,1000
"Business Leaders United for Boca Raton PC Pursuant to section 106.087(2)(a), Florida Statutes. 1800 North Dixie Highway, Boca Raton, 33432 Not approved by any candidate",1000
Boyd Corbin for Mayor of Wilton Manors,1000
Bilirakis for Congress,1000
Bernard Parker for Florida State Representative,1000
"Anna V. Eskamani, Democrat, for Florida House 47",1000
"Andrew Gillum, Democrat, for Governor",1000
Alianza for Progress,1000
Alachua County Democratic Party,1000
A More Perfect Union,1000
"and approved by Lauren Odman for Dania Beach City Commission, Nonpartisan",999
Patricia Kemp,999
"Doug Underhill, Republican, Candidate for Escambia County Commission, District 2",998
"Allison Gilman for Broward County Court Judge, Group 19, Non Partisan",998
Ben & Jerry's,994
"Mariella Smith, Democrat, for Hillsborough County Commission, Countywide (District 5).",986
Purpose Built Families Foundation,974
"Debbie Redmon Goulding, CEO of Real Florida Magazine and The Goulding Agency, LLC",954
Palm Bay Citizens for Change. A non partisan political committee.,934
"Jorge Luis Lopez, Esq.",934
" Nathcelly Rohrbaugh, Democrat, Florida House District 11",883
"and Authorized by Maryland Democratic Senate Caucus Committee; Patricia L. Horton, Treasurer",862
Friends of Nellie Gorbea,840
CRTV,826
The Leadership Conference on Civil and Human Rights ,815
"4Ocean, LLC",758
Civiqs,642
Organization United for Respect,619
Federal Voting Assistance Program,603
Dropkick Memes,560
Elizabeth for MA,549
Players Coalition,467
Hoover Institution,420
Gillibrand for Senate,418
"Stand for Children, Inc.",414
Healthy Living Initiative ,375
,351
"AAF Nation, LLC",309
Environmental Defense Fund,255
ConservativeMamaPhD,253
Change the Rules,217
News For Democracy,202
McCaskill for Missouri,165
the League of Women Voters,150
Affordable Housing Now Yes on Props 1 & 2 Coalition,125
ACLU of Northern California,117
Finance Watch Dogs,112
435 Labs,104
Donnelly for Indiana,92
"Voters Not Politicians | PO Box 8362 Grand Rapids, MI 49518",88
NRDC Action Fund,87
The Nature Conservancy,81
End Citizens United,80
the DSCC,78
JVMI,74
UltimateStraw,71
Retail Politics LLC,67
Patriot Depot,67
Friends of Alex Charlton,64
Michael Bailey,60
NRDC,59
Liberty Nation,59
Friends of Ron Stephens,59
SpeakEasy Political,58
UPROXX,56
Trump 2020,56
The Daily Wire,55
Everytown for Gun Safety Action Fund,49
Andrew Yang,49
Bird + Stone ,44
Protect Our Winters Action Fund,42
Friends of Jerry Alexander,39
G.I. Jobs Magazine,37
Oxfam America,35
Madison County Republican Central Committee,34
Planned Parenthood Federation of America,30
the North Carolina Democratic Party and Gayle Kemp for State House.,24
the North Carolina Democratic Party and Love for NC.,18
Shareblue Media,17
Friends of Ben McAdams,17
The Committee to Elect Amy Wasyluka for Senate,14
Rebecca Petty Campaign.,14
Human Rights Campaign PAC,14
Friends of Devon Conley for Mountain View Whisman SD 2018. FPPC# 1411638,13
Committee to Elect Treva Gear,12
Human Rights Campaign,11
"Committee to Elect Allan Kittleman; Bradley Myers, Treasurer",11
Seguin RV,9
Friends of Timothy David Ray,9
Republican Committee of Lancaster County,7
"the KRAUT FOR WESTPORT Committee, Gabriel Sasson, Treasurer. Approved by Greg Kraut.",6
Lesley for CU Regent,5
Koop for Texas,5
Friends of Christopher F. DAVIS,4
Energy Citizens,4
Rick Green for Congress,3
"Bill Meredith, member-owner Grady EMC, Member - Take Back Our Grady EMC, Founder/Fund Manager - The Meredith FX Fund",3
Friends of Chris Murphy,2
Alec J Rappleyea,2
Friends of Josie Raymond,1
the Voter Participation Center,0
the Trump Make America Great Again Committee,0
the North Carolina Democratic Party and Penelope Ann DiMaio 4 State House.,0
the North Carolina Democratic Party and Garner for North Carolina.,0
the Newseum,0
the National Network of Abortion Funds,0
the National Democratic Redistricting Committee,0
the NRCC and not authorized by any candidate or candidate's committee.,0
the Florida Democratic Party. Not authorized by any candidate or candidate's committee.,0
the Democratic National Committee,0
"the Committee to Elect Dave Ellis, Non-Partisan, 6th Circuit Court Judge, Group 4",0
the ACLU,0
"approved, and maintained by the committee of responsible persons to elect Gloria Walker Circuit Court Judge, Group 8, non-partisan.",0
"and approved by Nicole Haagenson, Democrat, for Florida House, District 54",0
"Zya, Inc. ",0
World of Children,0
World Wildlife Fund,0
Working Families Party,0
Women's March Broward,0
"Winning For Women, Inc.",0
West Wall Outfitters,0
Voto Latino,0
Vote Yes! for Success,0
"Viviana Janer, Democrat, for Osceola County Commission, Dist. 2",0
"Vice Mayor Robert ""Bob"" Shelley",0
Upton for All of Us.,0
United Way of Greater New Haven,0
USA for UNHCR,0
Turning Point USA,0
"True Science Holdings, LLC.",0
Trish Becker for Anastasia Mosquito Control District Seat 4,0
Transportation Is the Future,0
"Tony for Wisconsin. Connie Hutchison, Treasurer.",0
Tina Smith for Minnesota,0
The Years Project Action Fund,0
The Wilderness Society,0
The Right Way,0
The National Organization for the Reform of Marijuana Laws,0
"The Committee to Elect Ebo Entsuah for Clermont City Council, Seat 5",0
The Committee to Elect Cindy Lake,0
The Committee To Elect Lisa Ring,0
The Collective PAC; not authorized by any candidate or any candidate's committee.,0
The Atlas Society,0
Texans for Natural Gas,0
"Teri Johnston for Mayor - Key West, FL",0
"Tanner Channing Demmery for County Court Judge, Group 9, Non Partisan. Sent by the Committee of Responsible Persons for Tanner Channing Demmery for County Court Judge, Group 9.",0
T-Mobile,0
Swing Left. Not authorized by any candidate or candidate's committee.,0
Support The 2nd Amendment,0
Strengthen Our Schools,0
Steven G Heisler for Titusville City Council Seat 5,0
"Steve Spradley, Candidate for County Commissioner, Taylor County District 3, NPA",0
Stand Up America,0
"Stacey Hetherington, Republican, for County Commission District 2",0
St. Martin's Press,0
Spiritual Endeavors LLC,0
Smartwool,0
Smart Health Choice,0
Sinema for Arizona,0
Shepp4Sheriff Campaign,0
Sharice for Congress,0
"Shari McCartney, Republican, for Broward County Commission, District 4",0
Seminole Committee for Government Accountability,0
Seafood Harvesters of America,0
Science for Humans and Freedom Institute,0
Scamazon,0
Save the Redwoods League,0
"Sarasota Alliance for Fair Elections, Inc.",0
Salem Media Group Tampa Sarasota,0
"SAVE Action PAC - 1951 NW 7th Ave, Ste 600, Miami FL 33136.",0
"Ruta Maria Jouniari, Democrat for Sarasota County Commission, District 2",0
"Robert ""Bobby"" Olszewski, Republican for State House, District 44",0
Resistance School,0
Recovery Advocacy Project ,0
Realtors® Political Advocacy Committee,0
Real Justice PAC and not authorized by any candidate or candidate's committee.,0
"Ray Martin, Non-Partisan, Lauderhill Commission, Seat #4",0
"REGULATED FUNDS BY MICHIGAN PLANNED PARENTHOOD VOTES SUPER PAC, P.O. BOX 15041, LANSING, MI 48901. NOT AUTHORIZED BY ANY CANDIDATE OR CANDIDATE’S COMMITTEE.",0
Progress Puerto Rico PAC and not authorized by any candidate or candidate's committee.,0
Priorities USA Action and SMP. (302) 469-3772. (202) 871-9255. Not authorized by any candidate or candidate's committee.,0
Primos Justice Network,0
Política Ya,0
Plant City Main Street,0
Phone2Action,0
Phil Beracha for Margate City Commissioner Seat 3,0
Pfizer,0
Perlmutter for Congress,0
"Patriot Productions, LLC",0
Patriot Powered Products and Publications,0
"Paolo Weston for Mayor, West Palm Beach",0
Palm Beach Civic Association,0
"Paid for and approved by Christian Ziegler, Republican for Sarasota County Commission, District 2",0
"Olivia Babis, Democrat, for Florida Senate District 23. ",0
Okaloosa County Supervisor of Elections,0
Oceana,0
Ocean Conservancy,0
Northwest Neighborhood Association,0
"No Plan, No Accountability, No on Prop C",0
No Kid Hungry,0
Newsom for California Governor 2018,0
National Solar Rebate,0
National Rural Electric Association,0
"Nate Kilton, Plant City Commissioner",0
"MoveOn.org Political Action, pol.moveon.org, not authorized by any candidate or candidate's committee.",0
MoveOn.org Civic Action.,0
Military Officers Association of America (MOAA),0
Military History Working Group at the Hoover Institution,0
Mikie Sherrill for Congress,0
"Mike Wells, Republican, for Pasco County Commissioner, District 4.",0
"Mike Moore, Republican for Pasco County Commissioner District 2",0
"Michael Joseph Campaign for City Commissioner, Group 7",0
Michael Barrineau,0
Miami-Dade Democrats,0
"Meshon Rawls, Nonpartisan, for Alachua County Judge, Group 2",0
Mercy Corps,0
"Maxine Cheesman for 15th Judicial Circuit Court Judge, Group 18.",0
"Matt Theobald, Democrat, for State Representative, District 83",0
"Maria Markhasin-Weekes for Broward County Circuit Court Judge, Group 46, Non Partisan",0
Making Every Vote Count,0
Local Majority,0
"Let's Talk Nation, LLC.",0
Laura Shaffer For Circuit Court Judge,0
Lake County Republican Party,0
Klean Kanteen,0
Kevin Biederman for Hollywood Commission District 5,0
Ken King for State Representative,0
Karen Cooper Welzel-D for Polk County Commission District 4,0
Kamala Harris for Senate,0
"Justin York, Non-Partisan, for Lake Mary City Commission, Seat 1. All Rights Reserved",0
John Kissick for Marathon City Council,0
Jeff Merkley for Oregon,0
"Jeff Brandes, Republican, for State Senate",0
"Jason Haeseler, Democrat for Florida House District 21",0
"Janet Cruz, Democrat, for State Senate, District 18",0
James Thompson for Kansas,0
Issue One,0
Instagram,0
Indivisible Project,0
Indivisible Action,0
"Important, Not Important LLC",0
IVN News,0
Human Coalition,0
Highlands County Republican Executive Committee,0
Heifer International,0
Heidi for North Dakota,0
Headline Shirts,0
Harder for Congress,0
Grover Robinson for Pensacola Mayor,0
Great America Alliance,0
Gravis Marketing,0
Gilbert Montalvo,0
"GLSEN, creating safe & LGBTQ-inclusive K-12 schools.",0
Friends of Rosa DeLauro,0
"Friends of Jonathan Porter; Brenden Carlson, Treasurer",0
Friends of Jan Schneider,0
Friends of Dana Balter,0
Friends of Beth Liston,0
FreedomWorks for America. Not authorized by any candidate or candidate's committee.,0
FreedomWorks,0
"Floridians For Freedom 1375 Cypress Avenue Melbourne, FL.32935. Supporting Legalization via FL. Ballot Initiative 15-20 to Legalize Cannabis/Marijuana in Florida.  ",0
Florida Politics.,0
Fire Ted Cruz PAC,0
Fipple,0
Everytown for Gun Safety Action Fund. Not authorized by any candidate or candidate’s committee.,0
Eunice Garbutt for Groveland City Council District 5,0
Equality Florida,0
End Citizens United Nonfederal,0
"Donald J. Trump for President, Inc.",0
"Democratic Environmental Caucus of Florida, Pasco Chapter",0
Demand Justice,0
Debra J.M. Smith of Informing Christians ,0
"Debra Bellanti, Democrat for State Representative District 60.",0
"Darcy Richardson, Reform Party, for Governor",0
Daniel Webster for Congress,0
DCCC,0
"DAGA, democraticags.org, not authorized by any federal, state, or local candidate or candidate’s committee.",0
Craig Huey,0
Conservative Tribune,0
Conservation International,0
ConocoPhillips Company,0
Compassionate St. Augustine,0
Committee to Elect Soraya Diase Coffelt Governor,0
Committee to Elect Donna Cathy Judge,0
"Color of Change PAC, not authorized by any candidate or candidate’s committee. ",0
Clearing out the Clutter.  The views expressed are those of the author only.,0
"ClearPath Action, Inc. Not authorized by any candidate or candidate's committee.",0
"Citizens for Truth About Amendment 3, Inc., 601 S. Boulevard, Tampa, FL 33606",0
Change The Date Sarasota,0
"Caryl Shuham for Hollywood City Commissioner, District 1, Non-partisan",0
Campaign for Stephen R Deutsch Republican for Charlotte County Commissioner District 4,0
CREDO Mobile,0
CARE,0
Brian Spencer for Mayor,0
Bredesen for Senate,0
"Brandon Arrington, Democrat, Osceola County Commission District 3",0
Blue Wave Voters,0
Betsy Vaughn for Lee County School Board District 6 At-Large,0
"Ben Albritton, Republican, for State Senate District 26",0
Be a Hero PAC. Not authorized by any candidate or candidate’s committee.,0
Baria for Mississippi,0
"Barbara Cady, Democrat, for Florida House District 42.",0
Association for Accessible Medicines,0
Armed American Supply,0
Animal Matters,0
"Angelika Purkis for FL District 12, US Congress",0
Andy Young,0
Andrew Stoddard for Utah House 44,0
Amy Spetner Doughty,0
American Jewish World Service,0
Alyse for Alaska,0
"Alex Heeren, Democrat, for Florida House District 66.",0
"Alan Maio, Republican, for Sarasota County Commission.",0
Adam Schiff for Congress,0
Adam Jortner for Alabama Board of Education,0
AARP ,0
32BJ SEIU,0
#VoteTogether,0
 Penguin Young Readers,0
 Debbie Jordan Candidate for Lee County School Board District 4,0
